19:39:02.010536 IP blob.by4prdstr03a.store.core.windows.net.http > 10.0.0.5.49750: Flags [S.], seq 909808302, ack 2022989648, win 8192, options [mss 1440,nop,wscale 8,sackOK,TS val 253666243 ecr 20875896], length 0
19:39:02.449507 IP blob.by4prdstr03a.store.core.windows.net.http > 10.0.0.5.49751: Flags [S.], seq 551815351, ack 1238777423, win 8192, options [mss 1440,nop,wscale 8,sackOK,TS val 1786257 ecr 20876005], length 0
19:39:02.888681 IP blob.by4prdstr03a.store.core.windows.net.http > 10.0.0.5.49752: Flags [S.], seq 3044760159, ack 404026492, win 8192, options [mss 1440,nop,wscale 8,sackOK,TS val 255288053 ecr 20876115], length 0
19:39:03.343625 IP blob.by4prdstr03a.store.core.windows.net.http > 10.0.0.5.49753: Flags [S.], seq 60333383, ack 1667997207, win 8192, options [mss 1440,nop,wscale 8,sackOK,TS val 251467366 ecr 20876229], length 0
19:39:03.809915 IP blob.by4prdstr03a.store.core.windows.net.http > 10.0.0.5.49755: Flags [S.], seq 202611843, ack 3548123325, win 8192, options [mss 1440,nop,wscale 8,sackOK,TS val 248512557 ecr 20876345], length 0
19:39:04.246978 IP blob.by4prdstr03a.store.core.windows.net.http > 10.0.0.5.49758: Flags [S.], seq 2086348540, ack 2837637331, win 8192, options [mss 1440,nop,wscale 8,sackOK,TS val 248509474 ecr 20876455], length 0
19:39:04.679987 IP blob.by4prdstr03a.store.core.windows.net.http > 10.0.0.5.49760: Flags [S.], seq 3054937189, ack 3104547663, win 8192, options [mss 1440,nop,wscale 8,sackOK,TS val 255282684 ecr 20876563], length 0
19:39:05.119058 IP blob.by4prdstr03a.store.core.windows.net.http > 10.0.0.5.49761: Flags [S.], seq 1496757476, ack 3145758879, win 8192, options [mss 1440,nop,wscale 8,sackOK,TS val 249361670 ecr 20876673], length 0
19:39:05.562016 IP blob.by4prdstr03a.store.core.windows.net.http > 10.0.0.5.49762: Flags [S.], seq 3685096597, ack 3633931970, win 8192, options [mss 1440,nop,wscale 8,sackOK,TS val 254404966 ecr 20876784], length 0
19:39:06.000112 IP blob.by4prdstr03a.store.core.windows.net.http > 10.0.0.5.49763: Flags [S.], seq 2725512900, ack 232746432, win 8192, options [mss 1440,nop,wscale 8,sackOK,TS val 250809089 ecr 20876893], length 0
19:39:06.470933 IP blob.by4prdstr03a.store.core.windows.net.http > 10.0.0.5.49764: Flags [S.], seq 2779144278, ack 908932966, win 8192, options [mss 1440,nop,wscale 8,sackOK,TS val 239266559 ecr 20877011], length 0
19:39:06.941853 IP blob.by4prdstr03a.store.core.windows.net.http > 10.0.0.5.49766: Flags [S.], seq 1875541768, ack 1757610663, win 8192, options [mss 1440,nop,wscale 8,sackOK,TS val 255294187 ecr 20877129], length 0
19:39:07.144709 IP blob.dm3prdstp05c.store.core.windows.net.https > 10.0.0.5.46971: Flags [S.], seq 3834114719, ack 3955966736, win 8192, options [mss 1440,nop,wscale 8,sackOK,TS val 247760516 ecr 20877189], length 0
19:39:07.157162 IP blob.dm3prdstp05c.store.core.windows.net.https > 10.0.0.5.46972: Flags [S.], seq 2686786263, ack 839256832, win 8192, options [mss 1440,nop,wscale 8,sackOK,TS val 247394746 ecr 20877192], length 0
19:39:07.169758 IP blob.dm3prdstp05c.store.core.windows.net.https > 10.0.0.5.46973: Flags [S.], seq 3495775537, ack 35256883, win 8192, options [mss 1440,nop,wscale 8,sackOK,TS val 249759690 ecr 20877195], length 0
19:39:07.411021 IP blob.by4prdstr03a.store.core.windows.net.http > 10.0.0.5.49771: Flags [S.], seq 147474800, ack 1844088591, win 8192, options [mss 1440,nop,wscale 8,sackOK,TS val 239283447 ecr 20877246], length 0
19:39:07.836762 IP blob.by4prdstr03a.store.core.windows.net.http > 10.0.0.5.49772: Flags [S.], seq 3244562285, ack 5103988, win 8192, options [mss 1440,nop,wscale 8,sackOK,TS val 253680063 ecr 20877352], length 0
19:39:08.315984 IP blob.by4prdstr03a.store.core.windows.net.http > 10.0.0.5.49773: Flags [S.], seq 2761483348, ack 2490360914, win 8192, options [mss 1440,nop,wscale 8,sackOK,TS val 14109163 ecr 20877472], length 0
19:39:08.739229 IP blob.by4prdstr03a.store.core.windows.net.http > 10.0.0.5.49774: Flags [S.], seq 838346299, ack 2557402572, win 8192, options [mss 1440,nop,wscale 8,sackOK,TS val 253669610 ecr 20877578], length 0
19:39:09.201699 IP blob.by4prdstr03a.store.core.windows.net.http > 10.0.0.5.49775: Flags [S.], seq 1430474780, ack 962409114, win 8192, options [mss 1440,nop,wscale 8,sackOK,TS val 254414373 ecr 20877694], length 0
19:39:09.676318 IP blob.by4prdstr03a.store.core.windows.net.http > 10.0.0.5.49776: Flags [S.], seq 3874664000, ack 2276798102, win 8192, options [mss 1440,nop,wscale 8,sackOK,TS val 251490264 ecr 20877812], length 0
19:39:10.103012 IP blob.by4prdstr03a.store.core.windows.net.http > 10.0.0.5.49777: Flags [S.], seq 1661232878, ack 205751695, win 8192, options [mss 1440,nop,wscale 8,sackOK,TS val 256031897 ecr 20877919], length 0
19:39:10.531319 IP blob.by4prdstr03a.store.core.windows.net.http > 10.0.0.5.49778: Flags [S.], seq 4151567716, ack 1354269603, win 8192, options [mss 1440,nop,wscale 8,sackOK,TS val 125834037 ecr 20878026], length 0
19:39:10.953199 IP blob.by4prdstr03a.store.core.windows.net.http > 10.0.0.5.49779: Flags [S.], seq 588920989, ack 3825853052, win 8192, options [mss 1440,nop,wscale 8,sackOK,TS val 1667568 ecr 20878132], length 0
19:39:11.401415 IP blob.by4prdstr03a.store.core.windows.net.http > 10.0.0.5.49780: Flags [S.], seq 3914808386, ack 724663045, win 8192, options [mss 1440,nop,wscale 8,sackOK,TS val 250793491 ecr 20878244], length 0
19:39:11.986029 IP blob.by4prdstr03a.store.core.windows.net.http > 10.0.0.5.49781: Flags [S.], seq 3905821603, ack 313303728, win 8192, options [mss 1440,nop,wscale 8,sackOK,TS val 20431699 ecr 20878390], length 0
19:39:12.413600 IP blob.by4prdstr03a.store.core.windows.net.http > 10.0.0.5.49782: Flags [S.], seq 3233658823, ack 908348770, win 8192, options [mss 1440,nop,wscale 8,sackOK,TS val 254409246 ecr 20878497], length 0
19:39:12.902066 IP blob.by4prdstr03a.store.core.windows.net.http > 10.0.0.5.49783: Flags [S.], seq 3832348800, ack 2587977233, win 8192, options [mss 1440,nop,wscale 8,sackOK,TS val 252127923 ecr 20878619], length 0
19:39:13.545033 IP blob.by4prdstr03a.store.core.windows.net.http > 10.0.0.5.49784: Flags [S.], seq 1625607338, ack 419065473, win 8192, options [mss 1440,nop,wscale 8,sackOK,TS val 254421474 ecr 20878780], length 0
19:39:14.046568 IP blob.by4prdstr03a.store.core.windows.net.http > 10.0.0.5.49785: Flags [S.], seq 2220956476, ack 3246573432, win 8192, options [mss 1440,nop,wscale 8,sackOK,TS val 251466504 ecr 20878905], length 0
19:39:14.542408 IP blob.by4prdstr03a.store.core.windows.net.http > 10.0.0.5.49786: Flags [S.], seq 1594527811, ack 2101850298, win 8192, options [mss 1440,nop,wscale 8,sackOK,TS val 253665378 ecr 20879029], length 0
19:39:15.003292 IP blob.by4prdstr03a.store.core.windows.net.http > 10.0.0.5.49787: Flags [S.], seq 102555957, ack 3020260125, win 8192, options [mss 1440,nop,wscale 8,sackOK,TS val 256010221 ecr 20879144], length 0
19:39:15.435366 IP blob.by4prdstr03a.store.core.windows.net.http > 10.0.0.5.49788: Flags [S.], seq 731971757, ack 1293839046, win 8192, options [mss 1440,nop,wscale 8,sackOK,TS val 250071162 ecr 20879252], length 0
19:39:15.872662 IP blob.by4prdstr03a.store.core.windows.net.http > 10.0.0.5.49789: Flags [S.], seq 1929791211, ack 663159286, win 8192, options [mss 1440,nop,wscale 8,sackOK,TS val 8785226 ecr 20879361], length 0
19:39:16.332633 IP blob.by4prdstr03a.store.core.windows.net.http > 10.0.0.5.49790: Flags [S.], seq 2199244280, ack 2356770622, win 8192, options [mss 1440,nop,wscale 8,sackOK,TS val 13149749 ecr 20879476], length 0
19:39:16.884521 IP blob.by4prdstr03a.store.core.windows.net.http > 10.0.0.5.49791: Flags [S.], seq 1189344457, ack 1279340291, win 8192, options [mss 1440,nop,wscale 8,sackOK,TS val 240520134 ecr 20879587], length 0
19:39:18.573929 IP blob.by4prdstr03a.store.core.windows.net.http > 10.0.0.5.49792: Flags [S.], seq 318482250, ack 2031637852, win 8192, options [mss 1440,nop,wscale 8,sackOK,TS val 4058387 ecr 20880037], length 0
19:39:19.065883 IP blob.by4prdstr03a.store.core.windows.net.http > 10.0.0.5.49793: Flags [S.], seq 3061112071, ack 3591114798, win 8192, options [mss 1440,nop,wscale 8,sackOK,TS val 252954031 ecr 20880160], length 0
19:39:19.483274 IP blob.by4prdstr03a.store.core.windows.net.http > 10.0.0.5.49794: Flags [S.], seq 2498673454, ack 3468559835, win 8192, options [mss 1440,nop,wscale 8,sackOK,TS val 254423416 ecr 20880264], length 0
19:39:19.951321 IP blob.by4prdstr03a.store.core.windows.net.http > 10.0.0.5.49795: Flags [S.], seq 1695776489, ack 2322541823, win 8192, options [mss 1440,nop,wscale 8,sackOK,TS val 3105055 ecr 20880381], length 0
19:39:20.387793 IP blob.by4prdstr03a.store.core.windows.net.http > 10.0.0.5.49796: Flags [S.], seq 4022537499, ack 1206841690, win 8192, options [mss 1440,nop,wscale 8,sackOK,TS val 255218463 ecr 20880490], length 0
19:39:20.861516 IP blob.by4prdstr03a.store.core.windows.net.http > 10.0.0.5.49797: Flags [S.], seq 4066914096, ack 2598900135, win 8192, options [mss 1440,nop,wscale 8,sackOK,TS val 21920079 ecr 20880609], length 0
19:39:21.295362 IP blob.by4prdstr03a.store.core.windows.net.http > 10.0.0.5.49798: Flags [S.], seq 227026258, ack 1698693540, win 8192, options [mss 1440,nop,wscale 8,sackOK,TS val 3298568 ecr 20880717], length 0
19:39:21.733983 IP blob.by4prdstr03a.store.core.windows.net.http > 10.0.0.5.49799: Flags [S.], seq 2124620037, ack 2479486293, win 8192, options [mss 1440,nop,wscale 8,sackOK,TS val 254400023 ecr 20880827], length 0
19:39:22.186603 IP blob.by4prdstr03a.store.core.windows.net.http > 10.0.0.5.49800: Flags [S.], seq 125962879, ack 2523394995, win 8192, options [mss 1440,nop,wscale 8,sackOK,TS val 255994652 ecr 20880940], length 0
19:39:22.630967 IP blob.by4prdstr03a.store.core.windows.net.http > 10.0.0.5.49801: Flags [S.], seq 1590944532, ack 241451448, win 8192, options [mss 1440,nop,wscale 8,sackOK,TS val 253668986 ecr 20881051], length 0
19:39:23.235227 IP blob.by4prdstr03a.store.core.windows.net.http > 10.0.0.5.49802: Flags [S.], seq 61466337, ack 2243659612, win 8192, options [mss 1440,nop,wscale 8,sackOK,TS val 256017629 ecr 20881202], length 0
19:39:23.693469 IP blob.by4prdstr03a.store.core.windows.net.http > 10.0.0.5.49803: Flags [S.], seq 3716398525, ack 2465408536, win 8192, options [mss 1440,nop,wscale 8,sackOK,TS val 250079667 ecr 20881317], length 0
19:39:24.167158 IP blob.by4prdstr03a.store.core.windows.net.http > 10.0.0.5.49804: Flags [S.], seq 3804168433, ack 126099112, win 8192, options [mss 1440,nop,wscale 8,sackOK,TS val 239263686 ecr 20881435], length 0
19:39:24.648696 IP blob.by4prdstr03a.store.core.windows.net.http > 10.0.0.5.49805: Flags [S.], seq 1025873573, ack 3666910427, win 8192, options [mss 1440,nop,wscale 8,sackOK,TS val 9949473 ecr 20881555], length 0
19:39:25.105036 IP blob.by4prdstr03a.store.core.windows.net.http > 10.0.0.5.49806: Flags [S.], seq 981782119, ack 1965891301, win 8192, options [mss 1440,nop,wscale 8,sackOK,TS val 252136569 ecr 20881670], length 0
19:39:25.575411 IP blob.by4prdstr03a.store.core.windows.net.http > 10.0.0.5.49807: Flags [S.], seq 1653999282, ack 3103516928, win 8192, options [mss 1440,nop,wscale 8,sackOK,TS val 252125863 ecr 20881787], length 0
19:39:26.021219 IP blob.by4prdstr03a.store.core.windows.net.http > 10.0.0.5.49808: Flags [S.], seq 546264299, ack 2900324113, win 8192, options [mss 1440,nop,wscale 8,sackOK,TS val 251481618 ecr 20881899], length 0
19:39:26.485969 IP blob.by4prdstr03a.store.core.windows.net.http > 10.0.0.5.49809: Flags [S.], seq 753223408, ack 1112821199, win 8192, options [mss 1440,nop,wscale 8,sackOK,TS val 239275603 ecr 20882015], length 0
19:39:26.955987 IP blob.by4prdstr03a.store.core.windows.net.http > 10.0.0.5.49810: Flags [S.], seq 3802753900, ack 1052724053, win 8192, options [mss 1440,nop,wscale 8,sackOK,TS val 11454199 ecr 20882132], length 0
19:39:27.435000 IP blob.by4prdstr03a.store.core.windows.net.http > 10.0.0.5.49811: Flags [S.], seq 4108535010, ack 1759388239, win 8192, options [mss 1440,nop,wscale 8,sackOK,TS val 256025352 ecr 20882252], length 0
19:39:27.863607 IP blob.by4prdstr03a.store.core.windows.net.http > 10.0.0.5.49812: Flags [S.], seq 1892436307, ack 1889095190, win 8192, options [mss 1440,nop,wscale 8,sackOK,TS val 249380487 ecr 20882359], length 0
19:39:28.319415 IP blob.by4prdstr03a.store.core.windows.net.http > 10.0.0.5.49813: Flags [S.], seq 2123196234, ack 1891148162, win 8192, options [mss 1440,nop,wscale 8,sackOK,TS val 255279173 ecr 20882473], length 0
19:39:28.757254 IP blob.by4prdstr03a.store.core.windows.net.http > 10.0.0.5.49814: Flags [S.], seq 3643878215, ack 2477072081, win 8192, options [mss 1440,nop,wscale 8,sackOK,TS val 254403410 ecr 20882583], length 0
19:39:29.236997 IP blob.by4prdstr03a.store.core.windows.net.http > 10.0.0.5.49815: Flags [S.], seq 2583765776, ack 1683577112, win 8192, options [mss 1440,nop,wscale 8,sackOK,TS val 250787851 ecr 20882703], length 0
19:39:29.858551 IP blob.by4prdstr03a.store.core.windows.net.http > 10.0.0.5.49816: Flags [S.], seq 561222638, ack 972197029, win 8192, options [mss 1440,nop,wscale 8,sackOK,TS val 249355494 ecr 20882858], length 0
19:39:30.290732 IP blob.by4prdstr03a.store.core.windows.net.http > 10.0.0.5.49817: Flags [S.], seq 3937280388, ack 2190230082, win 8192, options [mss 1440,nop,wscale 8,sackOK,TS val 251487608 ecr 20882966], length 0
19:39:30.714619 IP blob.by4prdstr03a.store.core.windows.net.http > 10.0.0.5.49818: Flags [S.], seq 3147440343, ack 3126192267, win 8192, options [mss 1440,nop,wscale 8,sackOK,TS val 252135710 ecr 20883072], length 0
19:39:31.227989 IP blob.by4prdstr03a.store.core.windows.net.http > 10.0.0.5.49819: Flags [S.], seq 676544419, ack 1380185214, win 8192, options [mss 1440,nop,wscale 8,sackOK,TS val 256002629 ecr 20883200], length 0
19:39:31.823610 IP blob.by4prdstr03a.store.core.windows.net.http > 10.0.0.5.49820: Flags [S.], seq 3727269820, ack 568673372, win 8192, options [mss 1440,nop,wscale 8,sackOK,TS val 252134450 ecr 20883349], length 0
19:39:32.245486 IP blob.by4prdstr03a.store.core.windows.net.http > 10.0.0.5.49821: Flags [S.], seq 3502869723, ack 2295540733, win 8192, options [mss 1440,nop,wscale 8,sackOK,TS val 2304339 ecr 20883455], length 0
19:39:32.311172 IP blob.dm3prdstp05c.store.core.windows.net.https > 10.0.0.5.47026: Flags [S.], seq 3984122699, ack 1689953704, win 8192, options [mss 1440,nop,wscale 8,sackOK,TS val 248501808 ecr 20883480], length 0
19:39:32.323967 IP blob.dm3prdstp05c.store.core.windows.net.https > 10.0.0.5.47027: Flags [S.], seq 2068733460, ack 1507198614, win 8192, options [mss 1440,nop,wscale 8,sackOK,TS val 247032665 ecr 20883484], length 0
19:39:32.337734 IP blob.dm3prdstp05c.store.core.windows.net.https > 10.0.0.5.47028: Flags [S.], seq 1064532184, ack 3357374597, win 8192, options [mss 1440,nop,wscale 8,sackOK,TS val 248869302 ecr 20883487], length 0
19:39:32.724668 IP blob.by4prdstr03a.store.core.windows.net.http > 10.0.0.5.49826: Flags [S.], seq 2625450282, ack 1104574418, win 8192, options [mss 1440,nop,wscale 8,sackOK,TS val 252960528 ecr 20883574], length 0
19:39:33.150372 IP blob.by4prdstr03a.store.core.windows.net.http > 10.0.0.5.49827: Flags [S.], seq 1872018741, ack 3946102743, win 8192, options [mss 1440,nop,wscale 8,sackOK,TS val 239268597 ecr 20883681], length 0
19:39:33.640964 IP blob.by4prdstr03a.store.core.windows.net.http > 10.0.0.5.49828: Flags [S.], seq 893138641, ack 2107137061, win 8192, options [mss 1440,nop,wscale 8,sackOK,TS val 250803015 ecr 20883804], length 0
19:39:34.066933 IP blob.by4prdstr03a.store.core.windows.net.http > 10.0.0.5.49829: Flags [S.], seq 2056131730, ack 776492756, win 8192, options [mss 1440,nop,wscale 8,sackOK,TS val 16860148 ecr 20883910], length 0
19:39:34.551523 IP blob.by4prdstr03a.store.core.windows.net.http > 10.0.0.5.49830: Flags [S.], seq 1345974541, ack 1088777610, win 8192, options [mss 1440,nop,wscale 8,sackOK,TS val 255997141 ecr 20884031], length 0
19:39:35.117397 IP blob.by4prdstr03a.store.core.windows.net.http > 10.0.0.5.49831: Flags [S.], seq 1341767791, ack 538629689, win 8192, options [mss 1440,nop,wscale 8,sackOK,TS val 248512764 ecr 20884173], length 0
19:39:35.540721 IP blob.by4prdstr03a.store.core.windows.net.http > 10.0.0.5.49832: Flags [S.], seq 1987374207, ack 1575611335, win 8192, options [mss 1440,nop,wscale 8,sackOK,TS val 248510939 ecr 20884278], length 0
19:39:35.972291 IP blob.by4prdstr03a.store.core.windows.net.http > 10.0.0.5.49833: Flags [S.], seq 3614030038, ack 4110231870, win 8192, options [mss 1440,nop,wscale 8,sackOK,TS val 239267020 ecr 20884386], length 0
19:39:36.416407 IP blob.by4prdstr03a.store.core.windows.net.http > 10.0.0.5.49834: Flags [S.], seq 1434866353, ack 3793369456, win 8192, options [mss 1440,nop,wscale 8,sackOK,TS val 250085963 ecr 20884497], length 0
19:39:36.868790 IP blob.by4prdstr03a.store.core.windows.net.http > 10.0.0.5.49835: Flags [S.], seq 3899250779, ack 3098056234, win 8192, options [mss 1440,nop,wscale 8,sackOK,TS val 253679068 ecr 20884610], length 0
19:39:37.366043 IP blob.by4prdstr03a.store.core.windows.net.http > 10.0.0.5.49836: Flags [S.], seq 1969856813, ack 4263833982, win 8192, options [mss 1440,nop,wscale 8,sackOK,TS val 255099606 ecr 20884735], length 0
19:39:37.885170 IP blob.by4prdstr03a.store.core.windows.net.http > 10.0.0.5.49838: Flags [S.], seq 756723357, ack 294333957, win 8192, options [mss 1440,nop,wscale 8,sackOK,TS val 249370560 ecr 20884861], length 0
19:39:38.354960 IP blob.by4prdstr03a.store.core.windows.net.http > 10.0.0.5.49839: Flags [S.], seq 1532161231, ack 3789188825, win 8192, options [mss 1440,nop,wscale 8,sackOK,TS val 250805336 ecr 20884982], length 0
19:39:38.839889 IP blob.by4prdstr03a.store.core.windows.net.http > 10.0.0.5.49841: Flags [S.], seq 4006642089, ack 3817263869, win 8192, options [mss 1440,nop,wscale 8,sackOK,TS val 16441812 ecr 20885103], length 0
19:39:39.282427 IP blob.by4prdstr03a.store.core.windows.net.http > 10.0.0.5.49844: Flags [S.], seq 2981719721, ack 2866185681, win 8192, options [mss 1440,nop,wscale 8,sackOK,TS val 251497506 ecr 20885214], length 0
19:39:39.732916 IP blob.by4prdstr03a.store.core.windows.net.http > 10.0.0.5.49846: Flags [S.], seq 3203359824, ack 3767670713, win 8192, options [mss 1440,nop,wscale 8,sackOK,TS val 252129968 ecr 20885327], length 0
19:39:40.195583 IP blob.by4prdstr03a.store.core.windows.net.http > 10.0.0.5.49847: Flags [S.], seq 4080035833, ack 3579101856, win 8192, options [mss 1440,nop,wscale 8,sackOK,TS val 248501971 ecr 20885442], length 0
19:39:40.667349 IP blob.by4prdstr03a.store.core.windows.net.http > 10.0.0.5.49848: Flags [S.], seq 4243555986, ack 4141218742, win 8192, options [mss 1440,nop,wscale 8,sackOK,TS val 239278828 ecr 20885560], length 0
19:39:41.132761 IP blob.by4prdstr03a.store.core.windows.net.http > 10.0.0.5.49849: Flags [S.], seq 3221049508, ack 3248374979, win 8192, options [mss 1440,nop,wscale 8,sackOK,TS val 252944006 ecr 20885676], length 0
19:39:41.600053 IP blob.by4prdstr03a.store.core.windows.net.http > 10.0.0.5.49851: Flags [S.], seq 2966792076, ack 1294606289, win 8192, options [mss 1440,nop,wscale 8,sackOK,TS val 253672591 ecr 20885793], length 0
19:39:42.105264 IP blob.by4prdstr03a.store.core.windows.net.http > 10.0.0.5.49852: Flags [S.], seq 3815513120, ack 1115772456, win 8192, options [mss 1440,nop,wscale 8,sackOK,TS val 253671752 ecr 20885920], length 0
19:39:42.541058 IP blob.by4prdstr03a.store.core.windows.net.http > 10.0.0.5.49853: Flags [S.], seq 1425207731, ack 767194954, win 8192, options [mss 1440,nop,wscale 8,sackOK,TS val 249354018 ecr 20886029], length 0
19:39:42.971811 IP blob.by4prdstr03a.store.core.windows.net.http > 10.0.0.5.49854: Flags [S.], seq 2175119805, ack 3582340321, win 8192, options [mss 1440,nop,wscale 8,sackOK,TS val 250806667 ecr 20886136], length 0
19:39:43.442599 IP blob.by4prdstr03a.store.core.windows.net.http > 10.0.0.5.49855: Flags [S.], seq 3701454936, ack 898161767, win 8192, options [mss 1440,nop,wscale 8,sackOK,TS val 253687506 ecr 20886254], length 0
19:39:43.949794 IP blob.by4prdstr03a.store.core.windows.net.http > 10.0.0.5.49856: Flags [S.], seq 3350505712, ack 1499955503, win 8192, options [mss 1440,nop,wscale 8,sackOK,TS val 15177750 ecr 20886381], length 0
19:39:44.382991 IP blob.by4prdstr03a.store.core.windows.net.http > 10.0.0.5.49857: Flags [S.], seq 1720259443, ack 1112222149, win 8192, options [mss 1440,nop,wscale 8,sackOK,TS val 252956906 ecr 20886489], length 0
19:39:44.867528 IP blob.by4prdstr03a.store.core.windows.net.http > 10.0.0.5.49858: Flags [S.], seq 727859732, ack 1551639385, win 8192, options [mss 1440,nop,wscale 8,sackOK,TS val 255247494 ecr 20886610], length 0
19:39:45.346458 IP blob.by4prdstr03a.store.core.windows.net.http > 10.0.0.5.49859: Flags [S.], seq 1989019926, ack 1986122895, win 8192, options [mss 1440,nop,wscale 8,sackOK,TS val 250804251 ecr 20886730], length 0
19:39:45.833725 IP blob.by4prdstr03a.store.core.windows.net.http > 10.0.0.5.49860: Flags [S.], seq 2367039939, ack 2169300066, win 8192, options [mss 1440,nop,wscale 8,sackOK,TS val 252962100 ecr 20886852], length 0
19:39:46.277802 IP blob.by4prdstr03a.store.core.windows.net.http > 10.0.0.5.49861: Flags [S.], seq 2247551054, ack 3405471922, win 8192, options [mss 1440,nop,wscale 8,sackOK,TS val 16210700 ecr 20886963], length 0
19:39:46.732748 IP blob.by4prdstr03a.store.core.windows.net.http > 10.0.0.5.49862: Flags [S.], seq 3680017251, ack 1463390141, win 8192, options [mss 1440,nop,wscale 8,sackOK,TS val 252127126 ecr 20887076], length 0
19:39:47.164386 IP blob.by4prdstr03a.store.core.windows.net.http > 10.0.0.5.49863: Flags [S.], seq 87263452, ack 4036938670, win 8192, options [mss 1440,nop,wscale 8,sackOK,TS val 250794405 ecr 20887184], length 0
19:39:47.627438 IP blob.by4prdstr03a.store.core.windows.net.http > 10.0.0.5.49864: Flags [S.], seq 3411297414, ack 130676233, win 8192, options [mss 1440,nop,wscale 8,sackOK,TS val 250074132 ecr 20887300], length 0
19:39:48.108554 IP blob.by4prdstr03a.store.core.windows.net.http > 10.0.0.5.49865: Flags [S.], seq 753615292, ack 2094635951, win 8192, options [mss 1440,nop,wscale 8,sackOK,TS val 255999616 ecr 20887420], length 0
19:39:48.566527 IP blob.by4prdstr03a.store.core.windows.net.http > 10.0.0.5.49866: Flags [S.], seq 1246550351, ack 3966222327, win 8192, options [mss 1440,nop,wscale 8,sackOK,TS val 255275473 ecr 20887535], length 0
19:39:49.016042 IP blob.by4prdstr03a.store.core.windows.net.http > 10.0.0.5.49867: Flags [S.], seq 1088125599, ack 412049630, win 8192, options [mss 1440,nop,wscale 8,sackOK,TS val 250062315 ecr 20887647], length 0
19:39:49.484339 IP blob.by4prdstr03a.store.core.windows.net.http > 10.0.0.5.49868: Flags [S.], seq 3244021192, ack 934633814, win 8192, options [mss 1440,nop,wscale 8,sackOK,TS val 250072987 ecr 20887764], length 0
19:39:49.908228 IP blob.by4prdstr03a.store.core.windows.net.http > 10.0.0.5.49869: Flags [S.], seq 2210769905, ack 3511565576, win 8192, options [mss 1440,nop,wscale 8,sackOK,TS val 21148582 ecr 20887870], length 0
19:39:50.420766 IP blob.by4prdstr03a.store.core.windows.net.http > 10.0.0.5.49870: Flags [S.], seq 831435588, ack 687644152, win 8192, options [mss 1440,nop,wscale 8,sackOK,TS val 254411691 ecr 20887998], length 0
19:39:50.962816 IP blob.by4prdstr03a.store.core.windows.net.http > 10.0.0.5.49871: Flags [S.], seq 1830721071, ack 3450332945, win 8192, options [mss 1440,nop,wscale 8,sackOK,TS val 255223391 ecr 20888134], length 0
19:39:51.502518 IP blob.by4prdstr03a.store.core.windows.net.http > 10.0.0.5.49872: Flags [S.], seq 1197428536, ack 2431059580, win 8192, options [mss 1440,nop,wscale 8,sackOK,TS val 15061486 ecr 20888269], length 0
19:39:52.054564 IP blob.by4prdstr03a.store.core.windows.net.http > 10.0.0.5.49873: Flags [S.], seq 735349368, ack 3246712250, win 8192, options [mss 1440,nop,wscale 8,sackOK,TS val 249374077 ecr 20888407], length 0
19:39:52.587600 IP blob.by4prdstr03a.store.core.windows.net.http > 10.0.0.5.49874: Flags [S.], seq 1155429427, ack 2725769514, win 8192, options [mss 1440,nop,wscale 8,sackOK,TS val 249380134 ecr 20888540], length 0
19:39:53.094368 IP blob.by4prdstr03a.store.core.windows.net.http > 10.0.0.5.49875: Flags [S.], seq 3295261343, ack 4205469719, win 8192, options [mss 1440,nop,wscale 8,sackOK,TS val 252962194 ecr 20888667], length 0
19:39:53.597653 IP blob.by4prdstr03a.store.core.windows.net.http > 10.0.0.5.49876: Flags [S.], seq 3196935846, ack 882874834, win 8192, options [mss 1440,nop,wscale 8,sackOK,TS val 248505781 ecr 20888793], length 0
19:39:54.110450 IP blob.by4prdstr03a.store.core.windows.net.http > 10.0.0.5.49877: Flags [S.], seq 1288122235, ack 137843293, win 8192, options [mss 1440,nop,wscale 8,sackOK,TS val 6679549 ecr 20888921], length 0
19:39:54.632016 IP blob.by4prdstr03a.store.core.windows.net.http > 10.0.0.5.49878: Flags [S.], seq 173194975, ack 2252400190, win 8192, options [mss 1440,nop,wscale 8,sackOK,TS val 251487578 ecr 20889051], length 0
19:39:55.162876 IP blob.by4prdstr03a.store.core.windows.net.http > 10.0.0.5.49879: Flags [S.], seq 1963946787, ack 4168544828, win 8192, options [mss 1440,nop,wscale 8,sackOK,TS val 248523599 ecr 20889184], length 0
19:39:55.746992 IP blob.by4prdstr03a.store.core.windows.net.http > 10.0.0.5.49880: Flags [S.], seq 2039993836, ack 3918156463, win 8192, options [mss 1440,nop,wscale 8,sackOK,TS val 21574453 ecr 20889330], length 0
19:39:56.271172 IP blob.by4prdstr03a.store.core.windows.net.http > 10.0.0.5.49881: Flags [S.], seq 830699969, ack 92715861, win 8192, options [mss 1440,nop,wscale 8,sackOK,TS val 239290720 ecr 20889461], length 0
19:39:56.862169 IP blob.by4prdstr03a.store.core.windows.net.http > 10.0.0.5.49882: Flags [S.], seq 2451842169, ack 3627974879, win 8192, options [mss 1440,nop,wscale 8,sackOK,TS val 250061302 ecr 20889609], length 0
19:39:57.369748 IP blob.by4prdstr03a.store.core.windows.net.http > 10.0.0.5.49883: Flags [S.], seq 3742175302, ack 1948831436, win 8192, options [mss 1440,nop,wscale 8,sackOK,TS val 75867286 ecr 20889736], length 0
19:39:57.498933 IP blob.dm3prdstp05c.store.core.windows.net.https > 10.0.0.5.47088: Flags [S.], seq 3528122157, ack 49147556, win 8192, options [mss 1440,nop,wscale 8,sackOK,TS val 250071935 ecr 20889777], length 0
19:39:57.509616 IP blob.dm3prdstp05c.store.core.windows.net.https > 10.0.0.5.47089: Flags [S.], seq 153164387, ack 2607628236, win 8192, options [mss 1440,nop,wscale 8,sackOK,TS val 247765552 ecr 20889780], length 0
19:39:57.521785 IP blob.dm3prdstp05c.store.core.windows.net.https > 10.0.0.5.47090: Flags [S.], seq 131482802, ack 1985748293, win 8192, options [mss 1440,nop,wscale 8,sackOK,TS val 247399782 ecr 20889783], length 0
19:39:57.859242 IP blob.by4prdstr03a.store.core.windows.net.http > 10.0.0.5.49888: Flags [S.], seq 3261796914, ack 2724989192, win 8192, options [mss 1440,nop,wscale 8,sackOK,TS val 7665786 ecr 20889858], length 0
19:39:58.413766 IP blob.by4prdstr03a.store.core.windows.net.http > 10.0.0.5.49889: Flags [S.], seq 232240880, ack 2306538727, win 8192, options [mss 1440,nop,wscale 8,sackOK,TS val 249376662 ecr 20889997], length 0
19:39:58.960972 IP blob.by4prdstr03a.store.core.windows.net.http > 10.0.0.5.49890: Flags [S.], seq 1067937942, ack 2680855127, win 8192, options [mss 1440,nop,wscale 8,sackOK,TS val 250790351 ecr 20890134], length 0
19:39:59.448537 IP blob.by4prdstr03a.store.core.windows.net.http > 10.0.0.5.49891: Flags [S.], seq 3888773224, ack 3410286365, win 8192, options [mss 1440,nop,wscale 8,sackOK,TS val 248537691 ecr 20890255], length 0
19:39:59.965523 IP blob.by4prdstr03a.store.core.windows.net.http > 10.0.0.5.49892: Flags [S.], seq 3212989972, ack 2713274797, win 8192, options [mss 1440,nop,wscale 8,sackOK,TS val 253654110 ecr 20890385], length 0
19:40:00.452417 IP blob.by4prdstr03a.store.core.windows.net.http > 10.0.0.5.49893: Flags [S.], seq 3665118220, ack 2515485368, win 8192, options [mss 1440,nop,wscale 8,sackOK,TS val 255241025 ecr 20890506], length 0
19:40:00.969916 IP blob.by4prdstr03a.store.core.windows.net.http > 10.0.0.5.49894: Flags [S.], seq 1404894311, ack 2294259417, win 8192, options [mss 1440,nop,wscale 8,sackOK,TS val 252971530 ecr 20890636], length 0
19:40:01.480954 IP blob.by4prdstr03a.store.core.windows.net.http > 10.0.0.5.49895: Flags [S.], seq 2191441899, ack 1613729961, win 8192, options [mss 1440,nop,wscale 8,sackOK,TS val 252138256 ecr 20890764], length 0
19:40:01.985317 IP blob.by4prdstr03a.store.core.windows.net.http > 10.0.0.5.49896: Flags [S.], seq 3706980552, ack 1195407939, win 8192, options [mss 1440,nop,wscale 8,sackOK,TS val 11100238 ecr 20890890], length 0
19:40:02.501063 IP blob.by4prdstr03a.store.core.windows.net.http > 10.0.0.5.49897: Flags [S.], seq 2425316737, ack 657470271, win 8192, options [mss 1440,nop,wscale 8,sackOK,TS val 252959137 ecr 20891019], length 0
19:40:03.034349 IP blob.by4prdstr03a.store.core.windows.net.http > 10.0.0.5.49898: Flags [S.], seq 985201965, ack 1691736219, win 8192, options [mss 1440,nop,wscale 8,sackOK,TS val 253677163 ecr 20891152], length 0
19:40:03.558990 IP blob.by4prdstr03a.store.core.windows.net.http > 10.0.0.5.49899: Flags [S.], seq 1793583013, ack 381878256, win 8192, options [mss 1440,nop,wscale 8,sackOK,TS val 8196248 ecr 20891283], length 0
19:40:04.065491 IP blob.by4prdstr03a.store.core.windows.net.http > 10.0.0.5.49901: Flags [S.], seq 46694422, ack 990102518, win 8192, options [mss 1440,nop,wscale 8,sackOK,TS val 253674623 ecr 20891409], length 0
19:40:04.618732 IP blob.by4prdstr03a.store.core.windows.net.http > 10.0.0.5.49905: Flags [S.], seq 3651375669, ack 3213368317, win 8192, options [mss 1440,nop,wscale 8,sackOK,TS val 252150212 ecr 20891548], length 0
19:40:05.135485 IP blob.by4prdstr03a.store.core.windows.net.http > 10.0.0.5.49906: Flags [S.], seq 2012721434, ack 671360187, win 8192, options [mss 1440,nop,wscale 8,sackOK,TS val 256036524 ecr 20891677], length 0
19:40:05.670901 IP blob.by4prdstr03a.store.core.windows.net.http > 10.0.0.5.49907: Flags [S.], seq 1116922380, ack 4078248923, win 8192, options [mss 1440,nop,wscale 8,sackOK,TS val 3995216 ecr 20891811], length 0
19:40:06.278870 IP blob.by4prdstr03a.store.core.windows.net.http > 10.0.0.5.49908: Flags [S.], seq 654706727, ack 1258593741, win 8192, options [mss 1440,nop,wscale 8,sackOK,TS val 249379195 ecr 20891963], length 0
19:40:06.809161 IP blob.by4prdstr03a.store.core.windows.net.http > 10.0.0.5.49909: Flags [S.], seq 1700652169, ack 1879406386, win 8192, options [mss 1440,nop,wscale 8,sackOK,TS val 239265782 ecr 20892096], length 0
19:40:07.296744 IP blob.by4prdstr03a.store.core.windows.net.http > 10.0.0.5.49911: Flags [S.], seq 3792868974, ack 3831552053, win 8192, options [mss 1440,nop,wscale 8,sackOK,TS val 253686400 ecr 20892217], length 0
19:40:07.814481 IP blob.by4prdstr03a.store.core.windows.net.http > 10.0.0.5.49912: Flags [S.], seq 4076652295, ack 4220751469, win 8192, options [mss 1440,nop,wscale 8,sackOK,TS val 13802918 ecr 20892347], length 0
19:40:08.333297 IP blob.by4prdstr03a.store.core.windows.net.http > 10.0.0.5.49913: Flags [S.], seq 1239340593, ack 571551345, win 8192, options [mss 1440,nop,wscale 8,sackOK,TS val 255298140 ecr 20892477], length 0
19:40:08.854023 IP blob.by4prdstr03a.store.core.windows.net.http > 10.0.0.5.49914: Flags [S.], seq 1177150937, ack 3810806441, win 8192, options [mss 1440,nop,wscale 8,sackOK,TS val 3423584 ecr 20892607], length 0
19:40:09.317783 IP blob.by4prdstr03a.store.core.windows.net.http > 10.0.0.5.49915: Flags [S.], seq 3589624903, ack 336435975, win 8192, options [mss 1440,nop,wscale 8,sackOK,TS val 177582740 ecr 20892723], length 0
19:40:09.816348 IP blob.by4prdstr03a.store.core.windows.net.http > 10.0.0.5.49916: Flags [S.], seq 3708658645, ack 3874386113, win 8192, options [mss 1440,nop,wscale 8,sackOK,TS val 256007339 ecr 20892847], length 0
19:40:10.298011 IP blob.by4prdstr03a.store.core.windows.net.http > 10.0.0.5.49917: Flags [S.], seq 2833015220, ack 510620842, win 8192, options [mss 1440,nop,wscale 8,sackOK,TS val 250807843 ecr 20892968], length 0
19:40:10.787640 IP blob.by4prdstr03a.store.core.windows.net.http > 10.0.0.5.49918: Flags [S.], seq 2222461039, ack 2148647743, win 8192, options [mss 1440,nop,wscale 8,sackOK,TS val 248526533 ecr 20893090], length 0
19:40:11.262678 IP blob.by4prdstr03a.store.core.windows.net.http > 10.0.0.5.49919: Flags [S.], seq 2228833134, ack 203584178, win 8192, options [mss 1440,nop,wscale 8,sackOK,TS val 255111742 ecr 20893209], length 0
19:40:11.740918 IP blob.by4prdstr03a.store.core.windows.net.http > 10.0.0.5.49920: Flags [S.], seq 4181782119, ack 4254132421, win 8192, options [mss 1440,nop,wscale 8,sackOK,TS val 250810140 ecr 20893329], length 0
19:40:12.260540 IP blob.by4prdstr03a.store.core.windows.net.http > 10.0.0.5.49921: Flags [S.], seq 556644923, ack 1211247536, win 8192, options [mss 1440,nop,wscale 8,sackOK,TS val 256029081 ecr 20893458], length 0
19:40:14.397868 IP blob.by4prdstr03a.store.core.windows.net.http > 10.0.0.5.49925: Flags [S.], seq 1229244259, ack 3432244314, win 8192, options [mss 1440,nop,wscale 8,sackOK,TS val 20004155 ecr 20893993], length 0
19:40:14.868906 IP blob.by4prdstr03a.store.core.windows.net.http > 10.0.0.5.49926: Flags [S.], seq 3415339735, ack 2134222453, win 8192, options [mss 1440,nop,wscale 8,sackOK,TS val 254405684 ecr 20894110], length 0
19:40:15.359249 IP blob.by4prdstr03a.store.core.windows.net.http > 10.0.0.5.49927: Flags [S.], seq 3322750176, ack 4191847433, win 8192, options [mss 1440,nop,wscale 8,sackOK,TS val 248522931 ecr 20894233], length 0
19:40:15.853926 IP blob.by4prdstr03a.store.core.windows.net.http > 10.0.0.5.49928: Flags [S.], seq 1489417882, ack 128054124, win 8192, options [mss 1440,nop,wscale 8,sackOK,TS val 253681360 ecr 20894356], length 0
19:40:16.327189 IP blob.by4prdstr03a.store.core.windows.net.http > 10.0.0.5.49929: Flags [S.], seq 783137838, ack 1076978995, win 8192, options [mss 1440,nop,wscale 8,sackOK,TS val 239277903 ecr 20894475], length 0
19:40:17.023289 IP blob.by4prdstr03a.store.core.windows.net.http > 10.0.0.5.49930: Flags [S.], seq 223930685, ack 601143948, win 8192, options [mss 1440,nop,wscale 8,sackOK,TS val 256035087 ecr 20894649], length 0
19:40:17.592408 IP blob.by4prdstr03a.store.core.windows.net.http > 10.0.0.5.49931: Flags [S.], seq 1743241074, ack 3940316093, win 8192, options [mss 1440,nop,wscale 8,sackOK,TS val 250797627 ecr 20894791], length 0
19:40:18.085879 IP blob.by4prdstr03a.store.core.windows.net.http > 10.0.0.5.49932: Flags [S.], seq 1555713074, ack 3305729287, win 8192, options [mss 1440,nop,wscale 8,sackOK,TS val 248509543 ecr 20894915], length 0
19:40:18.627796 IP blob.by4prdstr03a.store.core.windows.net.http > 10.0.0.5.49933: Flags [S.], seq 2031382669, ack 3461804044, win 8192, options [mss 1440,nop,wscale 8,sackOK,TS val 8313511 ecr 20895050], length 0
19:40:19.138414 IP blob.by4prdstr03a.store.core.windows.net.http > 10.0.0.5.49934: Flags [S.], seq 817184900, ack 815734255, win 8192, options [mss 1440,nop,wscale 8,sackOK,TS val 239279917 ecr 20895178], length 0
19:40:19.664741 IP blob.by4prdstr03a.store.core.windows.net.http > 10.0.0.5.49935: Flags [S.], seq 1665306167, ack 1271547887, win 8192, options [mss 1440,nop,wscale 8,sackOK,TS val 251486388 ecr 20895309], length 0
19:40:20.154217 IP blob.by4prdstr03a.store.core.windows.net.http > 10.0.0.5.49936: Flags [S.], seq 1725361049, ack 3830641564, win 8192, options [mss 1440,nop,wscale 8,sackOK,TS val 9321158 ecr 20895432], length 0
19:40:20.731873 IP blob.by4prdstr03a.store.core.windows.net.http > 10.0.0.5.49937: Flags [S.], seq 1290935760, ack 3485778268, win 8192, options [mss 1440,nop,wscale 8,sackOK,TS val 248505650 ecr 20895576], length 0
19:40:21.279949 IP blob.by4prdstr03a.store.core.windows.net.http > 10.0.0.5.49938: Flags [S.], seq 2847132532, ack 3576410352, win 8192, options [mss 1440,nop,wscale 8,sackOK,TS val 253664862 ecr 20895713], length 0
19:40:21.816047 IP blob.by4prdstr03a.store.core.windows.net.http > 10.0.0.5.49939: Flags [S.], seq 3506373988, ack 3354257403, win 8192, options [mss 1440,nop,wscale 8,sackOK,TS val 249362001 ecr 20895847], length 0
19:40:22.318836 IP blob.by4prdstr03a.store.core.windows.net.http > 10.0.0.5.49940: Flags [S.], seq 3158846698, ack 3665720707, win 8192, options [mss 1440,nop,wscale 8,sackOK,TS val 249365020 ecr 20895973], length 0
19:40:22.664888 IP blob.dm3prdstp05c.store.core.windows.net.https > 10.0.0.5.47145: Flags [S.], seq 1080514992, ack 3583996113, win 8192, options [mss 1440,nop,wscale 8,sackOK,TS val 251205729 ecr 20896069], length 0
19:40:22.676971 IP blob.dm3prdstp05c.store.core.windows.net.https > 10.0.0.5.47146: Flags [S.], seq 2753905315, ack 4194605391, win 8192, options [mss 1440,nop,wscale 8,sackOK,TS val 61882249 ecr 20896072], length 0
19:40:22.689696 IP blob.dm3prdstp05c.store.core.windows.net.https > 10.0.0.5.47147: Flags [S.], seq 436831371, ack 1111896951, win 8192, options [mss 1440,nop,wscale 8,sackOK,TS val 248505577 ecr 20896075], length 0
19:40:22.848055 IP blob.by4prdstr03a.store.core.windows.net.http > 10.0.0.5.49945: Flags [S.], seq 3198008200, ack 3874902573, win 8192, options [mss 1440,nop,wscale 8,sackOK,TS val 250815064 ecr 20896105], length 0
19:40:23.371927 IP blob.by4prdstr03a.store.core.windows.net.http > 10.0.0.5.49946: Flags [S.], seq 2453529951, ack 1690564697, win 8192, options [mss 1440,nop,wscale 8,sackOK,TS val 254408679 ecr 20896236], length 0
19:40:23.890650 IP blob.by4prdstr03a.store.core.windows.net.http > 10.0.0.5.49947: Flags [S.], seq 1534101451, ack 3191933019, win 8192, options [mss 1440,nop,wscale 8,sackOK,TS val 4434469 ecr 20896366], length 0
19:40:24.408712 IP blob.by4prdstr03a.store.core.windows.net.http > 10.0.0.5.49948: Flags [S.], seq 1437157216, ack 3119161500, win 8192, options [mss 1440,nop,wscale 8,sackOK,TS val 239285149 ecr 20896496], length 0
19:40:25.062461 IP blob.by4prdstr03a.store.core.windows.net.http > 10.0.0.5.49949: Flags [S.], seq 70314348, ack 444815809, win 8192, options [mss 1440,nop,wscale 8,sackOK,TS val 10983221 ecr 20896659], length 0
19:40:25.596859 IP blob.by4prdstr03a.store.core.windows.net.http > 10.0.0.5.49950: Flags [S.], seq 1802283301, ack 1279428740, win 8192, options [mss 1440,nop,wscale 8,sackOK,TS val 251465023 ecr 20896792], length 0
19:40:26.193728 IP blob.by4prdstr03a.store.core.windows.net.http > 10.0.0.5.49951: Flags [S.], seq 2138427304, ack 4185314862, win 8192, options [mss 1440,nop,wscale 8,sackOK,TS val 250077922 ecr 20896942], length 0
19:40:26.739422 IP blob.by4prdstr03a.store.core.windows.net.http > 10.0.0.5.49952: Flags [S.], seq 1184599542, ack 1287512363, win 8192, options [mss 1440,nop,wscale 8,sackOK,TS val 250799837 ecr 20897078], length 0
19:40:27.234418 IP blob.by4prdstr03a.store.core.windows.net.http > 10.0.0.5.49953: Flags [S.], seq 1178772790, ack 434511605, win 8192, options [mss 1440,nop,wscale 8,sackOK,TS val 252144256 ecr 20897202], length 0
19:40:27.765274 IP blob.by4prdstr03a.store.core.windows.net.http > 10.0.0.5.49954: Flags [S.], seq 763596605, ack 4133456776, win 8192, options [mss 1440,nop,wscale 8,sackOK,TS val 250066646 ecr 20897335], length 0
19:40:28.307735 IP blob.by4prdstr03a.store.core.windows.net.http > 10.0.0.5.49955: Flags [S.], seq 804757764, ack 176429889, win 8192, options [mss 1440,nop,wscale 8,sackOK,TS val 249372616 ecr 20897470], length 0
19:40:28.767307 IP blob.by4prdstr03a.store.core.windows.net.http > 10.0.0.5.49956: Flags [S.], seq 1140378753, ack 459292511, win 8192, options [mss 1440,nop,wscale 8,sackOK,TS val 256026358 ecr 20897585], length 0
19:40:29.257546 IP blob.by4prdstr03a.store.core.windows.net.http > 10.0.0.5.49957: Flags [S.], seq 3720694323, ack 3247798155, win 8192, options [mss 1440,nop,wscale 8,sackOK,TS val 12041425 ecr 20897708], length 0
