19:39:01.972675 IP 10.0.0.5.49750 > blob.by4prdstr03a.store.core.windows.net.http: Flags [S], seq 2022989647, win 29200, options [mss 1460,sackOK,TS val 20875896 ecr 0,nop,wscale 7], length 0
19:39:02.409805 IP 10.0.0.5.49751 > blob.by4prdstr03a.store.core.windows.net.http: Flags [S], seq 1238777422, win 29200, options [mss 1460,sackOK,TS val 20876005 ecr 0,nop,wscale 7], length 0
19:39:02.850712 IP 10.0.0.5.49752 > blob.by4prdstr03a.store.core.windows.net.http: Flags [S], seq 404026491, win 29200, options [mss 1460,sackOK,TS val 20876115 ecr 0,nop,wscale 7], length 0
19:39:03.305552 IP 10.0.0.5.49753 > blob.by4prdstr03a.store.core.windows.net.http: Flags [S], seq 1667997206, win 29200, options [mss 1460,sackOK,TS val 20876229 ecr 0,nop,wscale 7], length 0
19:39:03.770171 IP 10.0.0.5.49755 > blob.by4prdstr03a.store.core.windows.net.http: Flags [S], seq 3548123324, win 29200, options [mss 1460,sackOK,TS val 20876345 ecr 0,nop,wscale 7], length 0
19:39:04.209163 IP 10.0.0.5.49758 > blob.by4prdstr03a.store.core.windows.net.http: Flags [S], seq 2837637330, win 29200, options [mss 1460,sackOK,TS val 20876455 ecr 0,nop,wscale 7], length 0
19:39:04.641950 IP 10.0.0.5.49760 > blob.by4prdstr03a.store.core.windows.net.http: Flags [S], seq 3104547662, win 29200, options [mss 1460,sackOK,TS val 20876563 ecr 0,nop,wscale 7], length 0
19:39:05.081000 IP 10.0.0.5.49761 > blob.by4prdstr03a.store.core.windows.net.http: Flags [S], seq 3145758878, win 29200, options [mss 1460,sackOK,TS val 20876673 ecr 0,nop,wscale 7], length 0
19:39:05.524069 IP 10.0.0.5.49762 > blob.by4prdstr03a.store.core.windows.net.http: Flags [S], seq 3633931969, win 29200, options [mss 1460,sackOK,TS val 20876784 ecr 0,nop,wscale 7], length 0
19:39:05.960514 IP 10.0.0.5.49763 > blob.by4prdstr03a.store.core.windows.net.http: Flags [S], seq 232746431, win 29200, options [mss 1460,sackOK,TS val 20876893 ecr 0,nop,wscale 7], length 0
19:39:06.432983 IP 10.0.0.5.49764 > blob.by4prdstr03a.store.core.windows.net.http: Flags [S], seq 908932965, win 29200, options [mss 1460,sackOK,TS val 20877011 ecr 0,nop,wscale 7], length 0
19:39:06.903960 IP 10.0.0.5.49766 > blob.by4prdstr03a.store.core.windows.net.http: Flags [S], seq 1757610662, win 29200, options [mss 1460,sackOK,TS val 20877129 ecr 0,nop,wscale 7], length 0
19:39:07.144269 IP 10.0.0.5.46971 > blob.dm3prdstp05c.store.core.windows.net.https: Flags [S], seq 3955966735, win 29200, options [mss 1460,sackOK,TS val 20877189 ecr 0,nop,wscale 7], length 0
19:39:07.156802 IP 10.0.0.5.46972 > blob.dm3prdstp05c.store.core.windows.net.https: Flags [S], seq 839256831, win 29200, options [mss 1460,sackOK,TS val 20877192 ecr 0,nop,wscale 7], length 0
19:39:07.169492 IP 10.0.0.5.46973 > blob.dm3prdstp05c.store.core.windows.net.https: Flags [S], seq 35256882, win 29200, options [mss 1460,sackOK,TS val 20877195 ecr 0,nop,wscale 7], length 0
19:39:07.373236 IP 10.0.0.5.49771 > blob.by4prdstr03a.store.core.windows.net.http: Flags [S], seq 1844088590, win 29200, options [mss 1460,sackOK,TS val 20877246 ecr 0,nop,wscale 7], length 0
19:39:07.798872 IP 10.0.0.5.49772 > blob.by4prdstr03a.store.core.windows.net.http: Flags [S], seq 5103987, win 29200, options [mss 1460,sackOK,TS val 20877352 ecr 0,nop,wscale 7], length 0
19:39:08.278061 IP 10.0.0.5.49773 > blob.by4prdstr03a.store.core.windows.net.http: Flags [S], seq 2490360913, win 29200, options [mss 1460,sackOK,TS val 20877472 ecr 0,nop,wscale 7], length 0
19:39:08.701290 IP 10.0.0.5.49774 > blob.by4prdstr03a.store.core.windows.net.http: Flags [S], seq 2557402571, win 29200, options [mss 1460,sackOK,TS val 20877578 ecr 0,nop,wscale 7], length 0
19:39:09.163709 IP 10.0.0.5.49775 > blob.by4prdstr03a.store.core.windows.net.http: Flags [S], seq 962409113, win 29200, options [mss 1460,sackOK,TS val 20877694 ecr 0,nop,wscale 7], length 0
19:39:09.638438 IP 10.0.0.5.49776 > blob.by4prdstr03a.store.core.windows.net.http: Flags [S], seq 2276798101, win 29200, options [mss 1460,sackOK,TS val 20877812 ecr 0,nop,wscale 7], length 0
19:39:10.065224 IP 10.0.0.5.49777 > blob.by4prdstr03a.store.core.windows.net.http: Flags [S], seq 205751694, win 29200, options [mss 1460,sackOK,TS val 20877919 ecr 0,nop,wscale 7], length 0
19:39:10.492973 IP 10.0.0.5.49778 > blob.by4prdstr03a.store.core.windows.net.http: Flags [S], seq 1354269602, win 29200, options [mss 1460,sackOK,TS val 20878026 ecr 0,nop,wscale 7], length 0
19:39:10.915303 IP 10.0.0.5.49779 > blob.by4prdstr03a.store.core.windows.net.http: Flags [S], seq 3825853051, win 29200, options [mss 1460,sackOK,TS val 20878132 ecr 0,nop,wscale 7], length 0
19:39:11.363501 IP 10.0.0.5.49780 > blob.by4prdstr03a.store.core.windows.net.http: Flags [S], seq 724663044, win 29200, options [mss 1460,sackOK,TS val 20878244 ecr 0,nop,wscale 7], length 0
19:39:11.948201 IP 10.0.0.5.49781 > blob.by4prdstr03a.store.core.windows.net.http: Flags [S], seq 313303727, win 29200, options [mss 1460,sackOK,TS val 20878390 ecr 0,nop,wscale 7], length 0
19:39:12.375843 IP 10.0.0.5.49782 > blob.by4prdstr03a.store.core.windows.net.http: Flags [S], seq 908348769, win 29200, options [mss 1460,sackOK,TS val 20878497 ecr 0,nop,wscale 7], length 0
19:39:12.864317 IP 10.0.0.5.49783 > blob.by4prdstr03a.store.core.windows.net.http: Flags [S], seq 2587977232, win 29200, options [mss 1460,sackOK,TS val 20878619 ecr 0,nop,wscale 7], length 0
19:39:13.507112 IP 10.0.0.5.49784 > blob.by4prdstr03a.store.core.windows.net.http: Flags [S], seq 419065472, win 29200, options [mss 1460,sackOK,TS val 20878780 ecr 0,nop,wscale 7], length 0
19:39:14.007871 IP 10.0.0.5.49785 > blob.by4prdstr03a.store.core.windows.net.http: Flags [S], seq 3246573431, win 29200, options [mss 1460,sackOK,TS val 20878905 ecr 0,nop,wscale 7], length 0
19:39:14.504616 IP 10.0.0.5.49786 > blob.by4prdstr03a.store.core.windows.net.http: Flags [S], seq 2101850297, win 29200, options [mss 1460,sackOK,TS val 20879029 ecr 0,nop,wscale 7], length 0
19:39:14.965426 IP 10.0.0.5.49787 > blob.by4prdstr03a.store.core.windows.net.http: Flags [S], seq 3020260124, win 29200, options [mss 1460,sackOK,TS val 20879144 ecr 0,nop,wscale 7], length 0
19:39:15.397467 IP 10.0.0.5.49788 > blob.by4prdstr03a.store.core.windows.net.http: Flags [S], seq 1293839045, win 29200, options [mss 1460,sackOK,TS val 20879252 ecr 0,nop,wscale 7], length 0
19:39:15.834773 IP 10.0.0.5.49789 > blob.by4prdstr03a.store.core.windows.net.http: Flags [S], seq 663159285, win 29200, options [mss 1460,sackOK,TS val 20879361 ecr 0,nop,wscale 7], length 0
19:39:16.294775 IP 10.0.0.5.49790 > blob.by4prdstr03a.store.core.windows.net.http: Flags [S], seq 2356770621, win 29200, options [mss 1460,sackOK,TS val 20879476 ecr 0,nop,wscale 7], length 0
19:39:16.736649 IP 10.0.0.5.49791 > blob.by4prdstr03a.store.core.windows.net.http: Flags [S], seq 1279340290, win 29200, options [mss 1460,sackOK,TS val 20879587 ecr 0,nop,wscale 7], length 0
19:39:18.536074 IP 10.0.0.5.49792 > blob.by4prdstr03a.store.core.windows.net.http: Flags [S], seq 2031637851, win 29200, options [mss 1460,sackOK,TS val 20880037 ecr 0,nop,wscale 7], length 0
19:39:19.027895 IP 10.0.0.5.49793 > blob.by4prdstr03a.store.core.windows.net.http: Flags [S], seq 3591114797, win 29200, options [mss 1460,sackOK,TS val 20880160 ecr 0,nop,wscale 7], length 0
19:39:19.445551 IP 10.0.0.5.49794 > blob.by4prdstr03a.store.core.windows.net.http: Flags [S], seq 3468559834, win 29200, options [mss 1460,sackOK,TS val 20880264 ecr 0,nop,wscale 7], length 0
19:39:19.913623 IP 10.0.0.5.49795 > blob.by4prdstr03a.store.core.windows.net.http: Flags [S], seq 2322541822, win 29200, options [mss 1460,sackOK,TS val 20880381 ecr 0,nop,wscale 7], length 0
19:39:20.349998 IP 10.0.0.5.49796 > blob.by4prdstr03a.store.core.windows.net.http: Flags [S], seq 1206841689, win 29200, options [mss 1460,sackOK,TS val 20880490 ecr 0,nop,wscale 7], length 0
19:39:20.823531 IP 10.0.0.5.49797 > blob.by4prdstr03a.store.core.windows.net.http: Flags [S], seq 2598900134, win 29200, options [mss 1460,sackOK,TS val 20880609 ecr 0,nop,wscale 7], length 0
19:39:21.257580 IP 10.0.0.5.49798 > blob.by4prdstr03a.store.core.windows.net.http: Flags [S], seq 1698693539, win 29200, options [mss 1460,sackOK,TS val 20880717 ecr 0,nop,wscale 7], length 0
19:39:21.696081 IP 10.0.0.5.49799 > blob.by4prdstr03a.store.core.windows.net.http: Flags [S], seq 2479486292, win 29200, options [mss 1460,sackOK,TS val 20880827 ecr 0,nop,wscale 7], length 0
19:39:22.148707 IP 10.0.0.5.49800 > blob.by4prdstr03a.store.core.windows.net.http: Flags [S], seq 2523394994, win 29200, options [mss 1460,sackOK,TS val 20880940 ecr 0,nop,wscale 7], length 0
19:39:22.593146 IP 10.0.0.5.49801 > blob.by4prdstr03a.store.core.windows.net.http: Flags [S], seq 241451447, win 29200, options [mss 1460,sackOK,TS val 20881051 ecr 0,nop,wscale 7], length 0
19:39:23.197301 IP 10.0.0.5.49802 > blob.by4prdstr03a.store.core.windows.net.http: Flags [S], seq 2243659611, win 29200, options [mss 1460,sackOK,TS val 20881202 ecr 0,nop,wscale 7], length 0
19:39:23.655434 IP 10.0.0.5.49803 > blob.by4prdstr03a.store.core.windows.net.http: Flags [S], seq 2465408535, win 29200, options [mss 1460,sackOK,TS val 20881317 ecr 0,nop,wscale 7], length 0
19:39:24.129262 IP 10.0.0.5.49804 > blob.by4prdstr03a.store.core.windows.net.http: Flags [S], seq 126099111, win 29200, options [mss 1460,sackOK,TS val 20881435 ecr 0,nop,wscale 7], length 0
19:39:24.610900 IP 10.0.0.5.49805 > blob.by4prdstr03a.store.core.windows.net.http: Flags [S], seq 3666910426, win 29200, options [mss 1460,sackOK,TS val 20881555 ecr 0,nop,wscale 7], length 0
19:39:25.066999 IP 10.0.0.5.49806 > blob.by4prdstr03a.store.core.windows.net.http: Flags [S], seq 1965891300, win 29200, options [mss 1460,sackOK,TS val 20881670 ecr 0,nop,wscale 7], length 0
19:39:25.537450 IP 10.0.0.5.49807 > blob.by4prdstr03a.store.core.windows.net.http: Flags [S], seq 3103516927, win 29200, options [mss 1460,sackOK,TS val 20881787 ecr 0,nop,wscale 7], length 0
19:39:25.983130 IP 10.0.0.5.49808 > blob.by4prdstr03a.store.core.windows.net.http: Flags [S], seq 2900324112, win 29200, options [mss 1460,sackOK,TS val 20881899 ecr 0,nop,wscale 7], length 0
19:39:26.447972 IP 10.0.0.5.49809 > blob.by4prdstr03a.store.core.windows.net.http: Flags [S], seq 1112821198, win 29200, options [mss 1460,sackOK,TS val 20882015 ecr 0,nop,wscale 7], length 0
19:39:26.918102 IP 10.0.0.5.49810 > blob.by4prdstr03a.store.core.windows.net.http: Flags [S], seq 1052724052, win 29200, options [mss 1460,sackOK,TS val 20882132 ecr 0,nop,wscale 7], length 0
19:39:27.397026 IP 10.0.0.5.49811 > blob.by4prdstr03a.store.core.windows.net.http: Flags [S], seq 1759388238, win 29200, options [mss 1460,sackOK,TS val 20882252 ecr 0,nop,wscale 7], length 0
19:39:27.825653 IP 10.0.0.5.49812 > blob.by4prdstr03a.store.core.windows.net.http: Flags [S], seq 1889095189, win 29200, options [mss 1460,sackOK,TS val 20882359 ecr 0,nop,wscale 7], length 0
19:39:28.281461 IP 10.0.0.5.49813 > blob.by4prdstr03a.store.core.windows.net.http: Flags [S], seq 1891148161, win 29200, options [mss 1460,sackOK,TS val 20882473 ecr 0,nop,wscale 7], length 0
19:39:28.719269 IP 10.0.0.5.49814 > blob.by4prdstr03a.store.core.windows.net.http: Flags [S], seq 2477072080, win 29200, options [mss 1460,sackOK,TS val 20882583 ecr 0,nop,wscale 7], length 0
19:39:29.199027 IP 10.0.0.5.49815 > blob.by4prdstr03a.store.core.windows.net.http: Flags [S], seq 1683577111, win 29200, options [mss 1460,sackOK,TS val 20882703 ecr 0,nop,wscale 7], length 0
19:39:29.820563 IP 10.0.0.5.49816 > blob.by4prdstr03a.store.core.windows.net.http: Flags [S], seq 972197028, win 29200, options [mss 1460,sackOK,TS val 20882858 ecr 0,nop,wscale 7], length 0
19:39:30.252928 IP 10.0.0.5.49817 > blob.by4prdstr03a.store.core.windows.net.http: Flags [S], seq 2190230081, win 29200, options [mss 1460,sackOK,TS val 20882966 ecr 0,nop,wscale 7], length 0
19:39:30.676690 IP 10.0.0.5.49818 > blob.by4prdstr03a.store.core.windows.net.http: Flags [S], seq 3126192266, win 29200, options [mss 1460,sackOK,TS val 20883072 ecr 0,nop,wscale 7], length 0
19:39:31.189960 IP 10.0.0.5.49819 > blob.by4prdstr03a.store.core.windows.net.http: Flags [S], seq 1380185213, win 29200, options [mss 1460,sackOK,TS val 20883200 ecr 0,nop,wscale 7], length 0
19:39:31.785715 IP 10.0.0.5.49820 > blob.by4prdstr03a.store.core.windows.net.http: Flags [S], seq 568673371, win 29200, options [mss 1460,sackOK,TS val 20883349 ecr 0,nop,wscale 7], length 0
19:39:32.207614 IP 10.0.0.5.49821 > blob.by4prdstr03a.store.core.windows.net.http: Flags [S], seq 2295540732, win 29200, options [mss 1460,sackOK,TS val 20883455 ecr 0,nop,wscale 7], length 0
19:39:32.310774 IP 10.0.0.5.47026 > blob.dm3prdstp05c.store.core.windows.net.https: Flags [S], seq 1689953703, win 29200, options [mss 1460,sackOK,TS val 20883480 ecr 0,nop,wscale 7], length 0
19:39:32.323529 IP 10.0.0.5.47027 > blob.dm3prdstp05c.store.core.windows.net.https: Flags [S], seq 1507198613, win 29200, options [mss 1460,sackOK,TS val 20883484 ecr 0,nop,wscale 7], length 0
19:39:32.337253 IP 10.0.0.5.47028 > blob.dm3prdstp05c.store.core.windows.net.https: Flags [S], seq 3357374596, win 29200, options [mss 1460,sackOK,TS val 20883487 ecr 0,nop,wscale 7], length 0
19:39:32.686356 IP 10.0.0.5.49826 > blob.by4prdstr03a.store.core.windows.net.http: Flags [S], seq 1104574417, win 29200, options [mss 1460,sackOK,TS val 20883574 ecr 0,nop,wscale 7], length 0
19:39:33.112332 IP 10.0.0.5.49827 > blob.by4prdstr03a.store.core.windows.net.http: Flags [S], seq 3946102742, win 29200, options [mss 1460,sackOK,TS val 20883681 ecr 0,nop,wscale 7], length 0
19:39:33.603012 IP 10.0.0.5.49828 > blob.by4prdstr03a.store.core.windows.net.http: Flags [S], seq 2107137060, win 29200, options [mss 1460,sackOK,TS val 20883804 ecr 0,nop,wscale 7], length 0
19:39:34.029068 IP 10.0.0.5.49829 > blob.by4prdstr03a.store.core.windows.net.http: Flags [S], seq 776492755, win 29200, options [mss 1460,sackOK,TS val 20883910 ecr 0,nop,wscale 7], length 0
19:39:34.513629 IP 10.0.0.5.49830 > blob.by4prdstr03a.store.core.windows.net.http: Flags [S], seq 1088777609, win 29200, options [mss 1460,sackOK,TS val 20884031 ecr 0,nop,wscale 7], length 0
19:39:35.079351 IP 10.0.0.5.49831 > blob.by4prdstr03a.store.core.windows.net.http: Flags [S], seq 538629688, win 29200, options [mss 1460,sackOK,TS val 20884173 ecr 0,nop,wscale 7], length 0
19:39:35.502768 IP 10.0.0.5.49832 > blob.by4prdstr03a.store.core.windows.net.http: Flags [S], seq 1575611334, win 29200, options [mss 1460,sackOK,TS val 20884278 ecr 0,nop,wscale 7], length 0
19:39:35.934378 IP 10.0.0.5.49833 > blob.by4prdstr03a.store.core.windows.net.http: Flags [S], seq 4110231869, win 29200, options [mss 1460,sackOK,TS val 20884386 ecr 0,nop,wscale 7], length 0
19:39:36.378523 IP 10.0.0.5.49834 > blob.by4prdstr03a.store.core.windows.net.http: Flags [S], seq 3793369455, win 29200, options [mss 1460,sackOK,TS val 20884497 ecr 0,nop,wscale 7], length 0
19:39:36.830327 IP 10.0.0.5.49835 > blob.by4prdstr03a.store.core.windows.net.http: Flags [S], seq 3098056233, win 29200, options [mss 1460,sackOK,TS val 20884610 ecr 0,nop,wscale 7], length 0
19:39:37.328189 IP 10.0.0.5.49836 > blob.by4prdstr03a.store.core.windows.net.http: Flags [S], seq 4263833981, win 29200, options [mss 1460,sackOK,TS val 20884735 ecr 0,nop,wscale 7], length 0
19:39:37.833793 IP 10.0.0.5.49838 > blob.by4prdstr03a.store.core.windows.net.http: Flags [S], seq 294333956, win 29200, options [mss 1460,sackOK,TS val 20884861 ecr 0,nop,wscale 7], length 0
19:39:38.316929 IP 10.0.0.5.49839 > blob.by4prdstr03a.store.core.windows.net.http: Flags [S], seq 3789188824, win 29200, options [mss 1460,sackOK,TS val 20884982 ecr 0,nop,wscale 7], length 0
19:39:38.801885 IP 10.0.0.5.49841 > blob.by4prdstr03a.store.core.windows.net.http: Flags [S], seq 3817263868, win 29200, options [mss 1460,sackOK,TS val 20885103 ecr 0,nop,wscale 7], length 0
19:39:39.244468 IP 10.0.0.5.49844 > blob.by4prdstr03a.store.core.windows.net.http: Flags [S], seq 2866185680, win 29200, options [mss 1460,sackOK,TS val 20885214 ecr 0,nop,wscale 7], length 0
19:39:39.694987 IP 10.0.0.5.49846 > blob.by4prdstr03a.store.core.windows.net.http: Flags [S], seq 3767670712, win 29200, options [mss 1460,sackOK,TS val 20885327 ecr 0,nop,wscale 7], length 0
19:39:40.156825 IP 10.0.0.5.49847 > blob.by4prdstr03a.store.core.windows.net.http: Flags [S], seq 3579101855, win 29200, options [mss 1460,sackOK,TS val 20885442 ecr 0,nop,wscale 7], length 0
19:39:40.629351 IP 10.0.0.5.49848 > blob.by4prdstr03a.store.core.windows.net.http: Flags [S], seq 4141218741, win 29200, options [mss 1460,sackOK,TS val 20885560 ecr 0,nop,wscale 7], length 0
19:39:41.094803 IP 10.0.0.5.49849 > blob.by4prdstr03a.store.core.windows.net.http: Flags [S], seq 3248374978, win 29200, options [mss 1460,sackOK,TS val 20885676 ecr 0,nop,wscale 7], length 0
19:39:41.562114 IP 10.0.0.5.49851 > blob.by4prdstr03a.store.core.windows.net.http: Flags [S], seq 1294606288, win 29200, options [mss 1460,sackOK,TS val 20885793 ecr 0,nop,wscale 7], length 0
19:39:42.067320 IP 10.0.0.5.49852 > blob.by4prdstr03a.store.core.windows.net.http: Flags [S], seq 1115772455, win 29200, options [mss 1460,sackOK,TS val 20885920 ecr 0,nop,wscale 7], length 0
19:39:42.503180 IP 10.0.0.5.49853 > blob.by4prdstr03a.store.core.windows.net.http: Flags [S], seq 767194953, win 29200, options [mss 1460,sackOK,TS val 20886029 ecr 0,nop,wscale 7], length 0
19:39:42.933938 IP 10.0.0.5.49854 > blob.by4prdstr03a.store.core.windows.net.http: Flags [S], seq 3582340320, win 29200, options [mss 1460,sackOK,TS val 20886136 ecr 0,nop,wscale 7], length 0
19:39:43.404763 IP 10.0.0.5.49855 > blob.by4prdstr03a.store.core.windows.net.http: Flags [S], seq 898161766, win 29200, options [mss 1460,sackOK,TS val 20886254 ecr 0,nop,wscale 7], length 0
19:39:43.911979 IP 10.0.0.5.49856 > blob.by4prdstr03a.store.core.windows.net.http: Flags [S], seq 1499955502, win 29200, options [mss 1460,sackOK,TS val 20886381 ecr 0,nop,wscale 7], length 0
19:39:44.345042 IP 10.0.0.5.49857 > blob.by4prdstr03a.store.core.windows.net.http: Flags [S], seq 1112222148, win 29200, options [mss 1460,sackOK,TS val 20886489 ecr 0,nop,wscale 7], length 0
19:39:44.829384 IP 10.0.0.5.49858 > blob.by4prdstr03a.store.core.windows.net.http: Flags [S], seq 1551639384, win 29200, options [mss 1460,sackOK,TS val 20886610 ecr 0,nop,wscale 7], length 0
19:39:45.308393 IP 10.0.0.5.49859 > blob.by4prdstr03a.store.core.windows.net.http: Flags [S], seq 1986122894, win 29200, options [mss 1460,sackOK,TS val 20886730 ecr 0,nop,wscale 7], length 0
19:39:45.795784 IP 10.0.0.5.49860 > blob.by4prdstr03a.store.core.windows.net.http: Flags [S], seq 2169300065, win 29200, options [mss 1460,sackOK,TS val 20886852 ecr 0,nop,wscale 7], length 0
19:39:46.239884 IP 10.0.0.5.49861 > blob.by4prdstr03a.store.core.windows.net.http: Flags [S], seq 3405471921, win 29200, options [mss 1460,sackOK,TS val 20886963 ecr 0,nop,wscale 7], length 0
19:39:46.694765 IP 10.0.0.5.49862 > blob.by4prdstr03a.store.core.windows.net.http: Flags [S], seq 1463390140, win 29200, options [mss 1460,sackOK,TS val 20887076 ecr 0,nop,wscale 7], length 0
19:39:47.126396 IP 10.0.0.5.49863 > blob.by4prdstr03a.store.core.windows.net.http: Flags [S], seq 4036938669, win 29200, options [mss 1460,sackOK,TS val 20887184 ecr 0,nop,wscale 7], length 0
19:39:47.589126 IP 10.0.0.5.49864 > blob.by4prdstr03a.store.core.windows.net.http: Flags [S], seq 130676232, win 29200, options [mss 1460,sackOK,TS val 20887300 ecr 0,nop,wscale 7], length 0
19:39:48.070491 IP 10.0.0.5.49865 > blob.by4prdstr03a.store.core.windows.net.http: Flags [S], seq 2094635950, win 29200, options [mss 1460,sackOK,TS val 20887420 ecr 0,nop,wscale 7], length 0
19:39:48.528554 IP 10.0.0.5.49866 > blob.by4prdstr03a.store.core.windows.net.http: Flags [S], seq 3966222326, win 29200, options [mss 1460,sackOK,TS val 20887535 ecr 0,nop,wscale 7], length 0
19:39:48.978181 IP 10.0.0.5.49867 > blob.by4prdstr03a.store.core.windows.net.http: Flags [S], seq 412049629, win 29200, options [mss 1460,sackOK,TS val 20887647 ecr 0,nop,wscale 7], length 0
19:39:49.446409 IP 10.0.0.5.49868 > blob.by4prdstr03a.store.core.windows.net.http: Flags [S], seq 934633813, win 29200, options [mss 1460,sackOK,TS val 20887764 ecr 0,nop,wscale 7], length 0
19:39:49.870432 IP 10.0.0.5.49869 > blob.by4prdstr03a.store.core.windows.net.http: Flags [S], seq 3511565575, win 29200, options [mss 1460,sackOK,TS val 20887870 ecr 0,nop,wscale 7], length 0
19:39:50.382833 IP 10.0.0.5.49870 > blob.by4prdstr03a.store.core.windows.net.http: Flags [S], seq 687644151, win 29200, options [mss 1460,sackOK,TS val 20887998 ecr 0,nop,wscale 7], length 0
19:39:50.924888 IP 10.0.0.5.49871 > blob.by4prdstr03a.store.core.windows.net.http: Flags [S], seq 3450332944, win 29200, options [mss 1460,sackOK,TS val 20888134 ecr 0,nop,wscale 7], length 0
19:39:51.464621 IP 10.0.0.5.49872 > blob.by4prdstr03a.store.core.windows.net.http: Flags [S], seq 2431059579, win 29200, options [mss 1460,sackOK,TS val 20888269 ecr 0,nop,wscale 7], length 0
19:39:52.016506 IP 10.0.0.5.49873 > blob.by4prdstr03a.store.core.windows.net.http: Flags [S], seq 3246712249, win 29200, options [mss 1460,sackOK,TS val 20888407 ecr 0,nop,wscale 7], length 0
19:39:52.549618 IP 10.0.0.5.49874 > blob.by4prdstr03a.store.core.windows.net.http: Flags [S], seq 2725769513, win 29200, options [mss 1460,sackOK,TS val 20888540 ecr 0,nop,wscale 7], length 0
19:39:53.056309 IP 10.0.0.5.49875 > blob.by4prdstr03a.store.core.windows.net.http: Flags [S], seq 4205469718, win 29200, options [mss 1460,sackOK,TS val 20888667 ecr 0,nop,wscale 7], length 0
19:39:53.559654 IP 10.0.0.5.49876 > blob.by4prdstr03a.store.core.windows.net.http: Flags [S], seq 882874833, win 29200, options [mss 1460,sackOK,TS val 20888793 ecr 0,nop,wscale 7], length 0
19:39:54.071890 IP 10.0.0.5.49877 > blob.by4prdstr03a.store.core.windows.net.http: Flags [S], seq 137843292, win 29200, options [mss 1460,sackOK,TS val 20888921 ecr 0,nop,wscale 7], length 0
19:39:54.594181 IP 10.0.0.5.49878 > blob.by4prdstr03a.store.core.windows.net.http: Flags [S], seq 2252400189, win 29200, options [mss 1460,sackOK,TS val 20889051 ecr 0,nop,wscale 7], length 0
19:39:55.124824 IP 10.0.0.5.49879 > blob.by4prdstr03a.store.core.windows.net.http: Flags [S], seq 4168544827, win 29200, options [mss 1460,sackOK,TS val 20889184 ecr 0,nop,wscale 7], length 0
19:39:55.708991 IP 10.0.0.5.49880 > blob.by4prdstr03a.store.core.windows.net.http: Flags [S], seq 3918156462, win 29200, options [mss 1460,sackOK,TS val 20889330 ecr 0,nop,wscale 7], length 0
19:39:56.233274 IP 10.0.0.5.49881 > blob.by4prdstr03a.store.core.windows.net.http: Flags [S], seq 92715860, win 29200, options [mss 1460,sackOK,TS val 20889461 ecr 0,nop,wscale 7], length 0
19:39:56.824373 IP 10.0.0.5.49882 > blob.by4prdstr03a.store.core.windows.net.http: Flags [S], seq 3627974878, win 29200, options [mss 1460,sackOK,TS val 20889609 ecr 0,nop,wscale 7], length 0
19:39:57.331808 IP 10.0.0.5.49883 > blob.by4prdstr03a.store.core.windows.net.http: Flags [S], seq 1948831435, win 29200, options [mss 1460,sackOK,TS val 20889736 ecr 0,nop,wscale 7], length 0
19:39:57.498556 IP 10.0.0.5.47088 > blob.dm3prdstp05c.store.core.windows.net.https: Flags [S], seq 49147555, win 29200, options [mss 1460,sackOK,TS val 20889777 ecr 0,nop,wscale 7], length 0
19:39:57.509191 IP 10.0.0.5.47089 > blob.dm3prdstp05c.store.core.windows.net.https: Flags [S], seq 2607628235, win 29200, options [mss 1460,sackOK,TS val 20889780 ecr 0,nop,wscale 7], length 0
19:39:57.521425 IP 10.0.0.5.47090 > blob.dm3prdstp05c.store.core.windows.net.https: Flags [S], seq 1985748292, win 29200, options [mss 1460,sackOK,TS val 20889783 ecr 0,nop,wscale 7], length 0
19:39:57.821360 IP 10.0.0.5.49888 > blob.by4prdstr03a.store.core.windows.net.http: Flags [S], seq 2724989191, win 29200, options [mss 1460,sackOK,TS val 20889858 ecr 0,nop,wscale 7], length 0
19:39:58.375835 IP 10.0.0.5.49889 > blob.by4prdstr03a.store.core.windows.net.http: Flags [S], seq 2306538726, win 29200, options [mss 1460,sackOK,TS val 20889997 ecr 0,nop,wscale 7], length 0
19:39:58.922966 IP 10.0.0.5.49890 > blob.by4prdstr03a.store.core.windows.net.http: Flags [S], seq 2680855126, win 29200, options [mss 1460,sackOK,TS val 20890134 ecr 0,nop,wscale 7], length 0
19:39:59.410571 IP 10.0.0.5.49891 > blob.by4prdstr03a.store.core.windows.net.http: Flags [S], seq 3410286364, win 29200, options [mss 1460,sackOK,TS val 20890255 ecr 0,nop,wscale 7], length 0
19:39:59.927559 IP 10.0.0.5.49892 > blob.by4prdstr03a.store.core.windows.net.http: Flags [S], seq 2713274796, win 29200, options [mss 1460,sackOK,TS val 20890385 ecr 0,nop,wscale 7], length 0
19:40:00.414488 IP 10.0.0.5.49893 > blob.by4prdstr03a.store.core.windows.net.http: Flags [S], seq 2515485367, win 29200, options [mss 1460,sackOK,TS val 20890506 ecr 0,nop,wscale 7], length 0
19:40:00.931659 IP 10.0.0.5.49894 > blob.by4prdstr03a.store.core.windows.net.http: Flags [S], seq 2294259416, win 29200, options [mss 1460,sackOK,TS val 20890636 ecr 0,nop,wscale 7], length 0
19:40:01.442978 IP 10.0.0.5.49895 > blob.by4prdstr03a.store.core.windows.net.http: Flags [S], seq 1613729960, win 29200, options [mss 1460,sackOK,TS val 20890764 ecr 0,nop,wscale 7], length 0
19:40:01.947466 IP 10.0.0.5.49896 > blob.by4prdstr03a.store.core.windows.net.http: Flags [S], seq 1195407938, win 29200, options [mss 1460,sackOK,TS val 20890890 ecr 0,nop,wscale 7], length 0
19:40:02.463061 IP 10.0.0.5.49897 > blob.by4prdstr03a.store.core.windows.net.http: Flags [S], seq 657470270, win 29200, options [mss 1460,sackOK,TS val 20891019 ecr 0,nop,wscale 7], length 0
19:40:02.996196 IP 10.0.0.5.49898 > blob.by4prdstr03a.store.core.windows.net.http: Flags [S], seq 1691736218, win 29200, options [mss 1460,sackOK,TS val 20891152 ecr 0,nop,wscale 7], length 0
19:40:03.521151 IP 10.0.0.5.49899 > blob.by4prdstr03a.store.core.windows.net.http: Flags [S], seq 381878255, win 29200, options [mss 1460,sackOK,TS val 20891283 ecr 0,nop,wscale 7], length 0
19:40:04.025494 IP 10.0.0.5.49901 > blob.by4prdstr03a.store.core.windows.net.http: Flags [S], seq 990102517, win 29200, options [mss 1460,sackOK,TS val 20891409 ecr 0,nop,wscale 7], length 0
19:40:04.580834 IP 10.0.0.5.49905 > blob.by4prdstr03a.store.core.windows.net.http: Flags [S], seq 3213368316, win 29200, options [mss 1460,sackOK,TS val 20891548 ecr 0,nop,wscale 7], length 0
19:40:05.097483 IP 10.0.0.5.49906 > blob.by4prdstr03a.store.core.windows.net.http: Flags [S], seq 671360186, win 29200, options [mss 1460,sackOK,TS val 20891677 ecr 0,nop,wscale 7], length 0
19:40:05.633087 IP 10.0.0.5.49907 > blob.by4prdstr03a.store.core.windows.net.http: Flags [S], seq 4078248922, win 29200, options [mss 1460,sackOK,TS val 20891811 ecr 0,nop,wscale 7], length 0
19:40:06.240958 IP 10.0.0.5.49908 > blob.by4prdstr03a.store.core.windows.net.http: Flags [S], seq 1258593740, win 29200, options [mss 1460,sackOK,TS val 20891963 ecr 0,nop,wscale 7], length 0
19:40:06.771209 IP 10.0.0.5.49909 > blob.by4prdstr03a.store.core.windows.net.http: Flags [S], seq 1879406385, win 29200, options [mss 1460,sackOK,TS val 20892096 ecr 0,nop,wscale 7], length 0
19:40:07.258764 IP 10.0.0.5.49911 > blob.by4prdstr03a.store.core.windows.net.http: Flags [S], seq 3831552052, win 29200, options [mss 1460,sackOK,TS val 20892217 ecr 0,nop,wscale 7], length 0
19:40:07.775130 IP 10.0.0.5.49912 > blob.by4prdstr03a.store.core.windows.net.http: Flags [S], seq 4220751468, win 29200, options [mss 1460,sackOK,TS val 20892347 ecr 0,nop,wscale 7], length 0
19:40:08.295404 IP 10.0.0.5.49913 > blob.by4prdstr03a.store.core.windows.net.http: Flags [S], seq 571551344, win 29200, options [mss 1460,sackOK,TS val 20892477 ecr 0,nop,wscale 7], length 0
19:40:08.816165 IP 10.0.0.5.49914 > blob.by4prdstr03a.store.core.windows.net.http: Flags [S], seq 3810806440, win 29200, options [mss 1460,sackOK,TS val 20892607 ecr 0,nop,wscale 7], length 0
19:40:09.279846 IP 10.0.0.5.49915 > blob.by4prdstr03a.store.core.windows.net.http: Flags [S], seq 336435974, win 29200, options [mss 1460,sackOK,TS val 20892723 ecr 0,nop,wscale 7], length 0
19:40:09.778487 IP 10.0.0.5.49916 > blob.by4prdstr03a.store.core.windows.net.http: Flags [S], seq 3874386112, win 29200, options [mss 1460,sackOK,TS val 20892847 ecr 0,nop,wscale 7], length 0
19:40:10.260165 IP 10.0.0.5.49917 > blob.by4prdstr03a.store.core.windows.net.http: Flags [S], seq 510620841, win 29200, options [mss 1460,sackOK,TS val 20892968 ecr 0,nop,wscale 7], length 0
19:40:10.748230 IP 10.0.0.5.49918 > blob.by4prdstr03a.store.core.windows.net.http: Flags [S], seq 2148647742, win 29200, options [mss 1460,sackOK,TS val 20893090 ecr 0,nop,wscale 7], length 0
19:40:11.224863 IP 10.0.0.5.49919 > blob.by4prdstr03a.store.core.windows.net.http: Flags [S], seq 203584177, win 29200, options [mss 1460,sackOK,TS val 20893209 ecr 0,nop,wscale 7], length 0
19:40:11.703073 IP 10.0.0.5.49920 > blob.by4prdstr03a.store.core.windows.net.http: Flags [S], seq 4254132420, win 29200, options [mss 1460,sackOK,TS val 20893329 ecr 0,nop,wscale 7], length 0
19:40:12.222555 IP 10.0.0.5.49921 > blob.by4prdstr03a.store.core.windows.net.http: Flags [S], seq 1211247535, win 29200, options [mss 1460,sackOK,TS val 20893458 ecr 0,nop,wscale 7], length 0
19:40:14.359936 IP 10.0.0.5.49925 > blob.by4prdstr03a.store.core.windows.net.http: Flags [S], seq 3432244313, win 29200, options [mss 1460,sackOK,TS val 20893993 ecr 0,nop,wscale 7], length 0
19:40:14.830871 IP 10.0.0.5.49926 > blob.by4prdstr03a.store.core.windows.net.http: Flags [S], seq 2134222452, win 29200, options [mss 1460,sackOK,TS val 20894110 ecr 0,nop,wscale 7], length 0
19:40:15.321221 IP 10.0.0.5.49927 > blob.by4prdstr03a.store.core.windows.net.http: Flags [S], seq 4191847432, win 29200, options [mss 1460,sackOK,TS val 20894233 ecr 0,nop,wscale 7], length 0
19:40:15.813628 IP 10.0.0.5.49928 > blob.by4prdstr03a.store.core.windows.net.http: Flags [S], seq 128054123, win 29200, options [mss 1460,sackOK,TS val 20894356 ecr 0,nop,wscale 7], length 0
19:40:16.289184 IP 10.0.0.5.49929 > blob.by4prdstr03a.store.core.windows.net.http: Flags [S], seq 1076978994, win 29200, options [mss 1460,sackOK,TS val 20894475 ecr 0,nop,wscale 7], length 0
19:40:16.985257 IP 10.0.0.5.49930 > blob.by4prdstr03a.store.core.windows.net.http: Flags [S], seq 601143947, win 29200, options [mss 1460,sackOK,TS val 20894649 ecr 0,nop,wscale 7], length 0
19:40:17.554410 IP 10.0.0.5.49931 > blob.by4prdstr03a.store.core.windows.net.http: Flags [S], seq 3940316092, win 29200, options [mss 1460,sackOK,TS val 20894791 ecr 0,nop,wscale 7], length 0
19:40:18.047904 IP 10.0.0.5.49932 > blob.by4prdstr03a.store.core.windows.net.http: Flags [S], seq 3305729286, win 29200, options [mss 1460,sackOK,TS val 20894915 ecr 0,nop,wscale 7], length 0
19:40:18.589862 IP 10.0.0.5.49933 > blob.by4prdstr03a.store.core.windows.net.http: Flags [S], seq 3461804043, win 29200, options [mss 1460,sackOK,TS val 20895050 ecr 0,nop,wscale 7], length 0
19:40:19.098968 IP 10.0.0.5.49934 > blob.by4prdstr03a.store.core.windows.net.http: Flags [S], seq 815734254, win 29200, options [mss 1460,sackOK,TS val 20895178 ecr 0,nop,wscale 7], length 0
19:40:19.626710 IP 10.0.0.5.49935 > blob.by4prdstr03a.store.core.windows.net.http: Flags [S], seq 1271547886, win 29200, options [mss 1460,sackOK,TS val 20895309 ecr 0,nop,wscale 7], length 0
19:40:20.116411 IP 10.0.0.5.49936 > blob.by4prdstr03a.store.core.windows.net.http: Flags [S], seq 3830641563, win 29200, options [mss 1460,sackOK,TS val 20895432 ecr 0,nop,wscale 7], length 0
19:40:20.693960 IP 10.0.0.5.49937 > blob.by4prdstr03a.store.core.windows.net.http: Flags [S], seq 3485778267, win 29200, options [mss 1460,sackOK,TS val 20895576 ecr 0,nop,wscale 7], length 0
19:40:21.241977 IP 10.0.0.5.49938 > blob.by4prdstr03a.store.core.windows.net.http: Flags [S], seq 3576410351, win 29200, options [mss 1460,sackOK,TS val 20895713 ecr 0,nop,wscale 7], length 0
19:40:21.778127 IP 10.0.0.5.49939 > blob.by4prdstr03a.store.core.windows.net.http: Flags [S], seq 3354257402, win 29200, options [mss 1460,sackOK,TS val 20895847 ecr 0,nop,wscale 7], length 0
19:40:22.280919 IP 10.0.0.5.49940 > blob.by4prdstr03a.store.core.windows.net.http: Flags [S], seq 3665720706, win 29200, options [mss 1460,sackOK,TS val 20895973 ecr 0,nop,wscale 7], length 0
19:40:22.664505 IP 10.0.0.5.47145 > blob.dm3prdstp05c.store.core.windows.net.https: Flags [S], seq 3583996112, win 29200, options [mss 1460,sackOK,TS val 20896069 ecr 0,nop,wscale 7], length 0
19:40:22.676597 IP 10.0.0.5.47146 > blob.dm3prdstp05c.store.core.windows.net.https: Flags [S], seq 4194605390, win 29200, options [mss 1460,sackOK,TS val 20896072 ecr 0,nop,wscale 7], length 0
19:40:22.689329 IP 10.0.0.5.47147 > blob.dm3prdstp05c.store.core.windows.net.https: Flags [S], seq 1111896950, win 29200, options [mss 1460,sackOK,TS val 20896075 ecr 0,nop,wscale 7], length 0
19:40:22.810266 IP 10.0.0.5.49945 > blob.by4prdstr03a.store.core.windows.net.http: Flags [S], seq 3874902572, win 29200, options [mss 1460,sackOK,TS val 20896105 ecr 0,nop,wscale 7], length 0
19:40:23.332439 IP 10.0.0.5.49946 > blob.by4prdstr03a.store.core.windows.net.http: Flags [S], seq 1690564696, win 29200, options [mss 1460,sackOK,TS val 20896236 ecr 0,nop,wscale 7], length 0
19:40:23.852791 IP 10.0.0.5.49947 > blob.by4prdstr03a.store.core.windows.net.http: Flags [S], seq 3191933018, win 29200, options [mss 1460,sackOK,TS val 20896366 ecr 0,nop,wscale 7], length 0
19:40:24.370903 IP 10.0.0.5.49948 > blob.by4prdstr03a.store.core.windows.net.http: Flags [S], seq 3119161499, win 29200, options [mss 1460,sackOK,TS val 20896496 ecr 0,nop,wscale 7], length 0
19:40:25.024493 IP 10.0.0.5.49949 > blob.by4prdstr03a.store.core.windows.net.http: Flags [S], seq 444815808, win 29200, options [mss 1460,sackOK,TS val 20896659 ecr 0,nop,wscale 7], length 0
19:40:25.558864 IP 10.0.0.5.49950 > blob.by4prdstr03a.store.core.windows.net.http: Flags [S], seq 1279428739, win 29200, options [mss 1460,sackOK,TS val 20896792 ecr 0,nop,wscale 7], length 0
19:40:26.155875 IP 10.0.0.5.49951 > blob.by4prdstr03a.store.core.windows.net.http: Flags [S], seq 4185314861, win 29200, options [mss 1460,sackOK,TS val 20896942 ecr 0,nop,wscale 7], length 0
19:40:26.701458 IP 10.0.0.5.49952 > blob.by4prdstr03a.store.core.windows.net.http: Flags [S], seq 1287512362, win 29200, options [mss 1460,sackOK,TS val 20897078 ecr 0,nop,wscale 7], length 0
19:40:27.196499 IP 10.0.0.5.49953 > blob.by4prdstr03a.store.core.windows.net.http: Flags [S], seq 434511604, win 29200, options [mss 1460,sackOK,TS val 20897202 ecr 0,nop,wscale 7], length 0
19:40:27.727389 IP 10.0.0.5.49954 > blob.by4prdstr03a.store.core.windows.net.http: Flags [S], seq 4133456775, win 29200, options [mss 1460,sackOK,TS val 20897335 ecr 0,nop,wscale 7], length 0
19:40:28.269892 IP 10.0.0.5.49955 > blob.by4prdstr03a.store.core.windows.net.http: Flags [S], seq 176429888, win 29200, options [mss 1460,sackOK,TS val 20897470 ecr 0,nop,wscale 7], length 0
19:40:28.729445 IP 10.0.0.5.49956 > blob.by4prdstr03a.store.core.windows.net.http: Flags [S], seq 459292510, win 29200, options [mss 1460,sackOK,TS val 20897585 ecr 0,nop,wscale 7], length 0
19:40:29.219097 IP 10.0.0.5.49957 > blob.by4prdstr03a.store.core.windows.net.http: Flags [S], seq 3247798154, win 29200, options [mss 1460,sackOK,TS val 20897708 ecr 0,nop,wscale 7], length 0
19:40:29.950145 IP 10.0.0.5.49958 > blob.by4prdstr03a.store.core.windows.net.http: Flags [S], seq 2630844758, win 29200, options [mss 1460,sackOK,TS val 20897890 ecr 0,nop,wscale 7], length 0
19:40:30.482559 IP 10.0.0.5.49959 > blob.by4prdstr03a.store.core.windows.net.http: Flags [S], seq 2586986381, win 29200, options [mss 1460,sackOK,TS val 20898023 ecr 0,nop,wscale 7], length 0
19:40:31.045861 IP 10.0.0.5.49960 > blob.by4prdstr03a.store.core.windows.net.http: Flags [S], seq 3658388379, win 29200, options [mss 1460,sackOK,TS val 20898164 ecr 0,nop,wscale 7], length 0
19:40:31.616544 IP 10.0.0.5.49961 > blob.by4prdstr03a.store.core.windows.net.http: Flags [S], seq 3372864724, win 29200, options [mss 1460,sackOK,TS val 20898307 ecr 0,nop,wscale 7], length 0
19:40:32.133742 IP 10.0.0.5.49962 > blob.by4prdstr03a.store.core.windows.net.http: Flags [S], seq 1124161324, win 29200, options [mss 1460,sackOK,TS val 20898436 ecr 0,nop,wscale 7], length 0
19:40:32.723305 IP 10.0.0.5.49963 > blob.by4prdstr03a.store.core.windows.net.http: Flags [S], seq 4174753606, win 29200, options [mss 1460,sackOK,TS val 20898584 ecr 0,nop,wscale 7], length 0
19:40:33.212485 IP 10.0.0.5.49964 > blob.by4prdstr03a.store.core.windows.net.http: Flags [S], seq 1710300008, win 29200, options [mss 1460,sackOK,TS val 20898706 ecr 0,nop,wscale 7], length 0
19:40:33.739780 IP 10.0.0.5.49965 > blob.by4prdstr03a.store.core.windows.net.http: Flags [S], seq 322118853, win 29200, options [mss 1460,sackOK,TS val 20898838 ecr 0,nop,wscale 7], length 0
19:40:34.219574 IP 10.0.0.5.49966 > blob.by4prdstr03a.store.core.windows.net.http: Flags [S], seq 3577516762, win 29200, options [mss 1460,sackOK,TS val 20898958 ecr 0,nop,wscale 7], length 0
19:40:34.756994 IP 10.0.0.5.49967 > blob.by4prdstr03a.store.core.windows.net.http: Flags [S], seq 582600952, win 29200, options [mss 1460,sackOK,TS val 20899092 ecr 0,nop,wscale 7], length 0
19:40:35.237783 IP 10.0.0.5.49968 > blob.by4prdstr03a.store.core.windows.net.http: Flags [S], seq 1083367979, win 29200, options [mss 1460,sackOK,TS val 20899212 ecr 0,nop,wscale 7], length 0
19:40:35.776608 IP 10.0.0.5.49969 > blob.by4prdstr03a.store.core.windows.net.http: Flags [S], seq 4014976841, win 29200, options [mss 1460,sackOK,TS val 20899347 ecr 0,nop,wscale 7], length 0
19:40:36.269777 IP 10.0.0.5.49970 > blob.by4prdstr03a.store.core.windows.net.http: Flags [S], seq 2313175928, win 29200, options [mss 1460,sackOK,TS val 20899470 ecr 0,nop,wscale 7], length 0
19:40:36.740060 IP 10.0.0.5.49971 > blob.by4prdstr03a.store.core.windows.net.http: Flags [S], seq 4011929560, win 29200, options [mss 1460,sackOK,TS val 20899588 ecr 0,nop,wscale 7], length 0
19:40:37.290947 IP 10.0.0.5.49972 > blob.by4prdstr03a.store.core.windows.net.http: Flags [S], seq 1614605588, win 29200, options [mss 1460,sackOK,TS val 20899726 ecr 0,nop,wscale 7], length 0
19:40:37.802508 IP 10.0.0.5.49974 > blob.by4prdstr03a.store.core.windows.net.http: Flags [S], seq 746850538, win 29200, options [mss 1460,sackOK,TS val 20899853 ecr 0,nop,wscale 7], length 0
19:40:38.291308 IP 10.0.0.5.49975 > blob.by4prdstr03a.store.core.windows.net.http: Flags [S], seq 1941484286, win 29200, options [mss 1460,sackOK,TS val 20899976 ecr 0,nop,wscale 7], length 0
19:40:38.999845 IP 10.0.0.5.49978 > blob.by4prdstr03a.store.core.windows.net.http: Flags [S], seq 2752839374, win 29200, options [mss 1460,sackOK,TS val 20900153 ecr 0,nop,wscale 7], length 0
19:40:39.571501 IP 10.0.0.5.49981 > blob.by4prdstr03a.store.core.windows.net.http: Flags [S], seq 783814654, win 29200, options [mss 1460,sackOK,TS val 20900296 ecr 0,nop,wscale 7], length 0
19:40:40.102128 IP 10.0.0.5.49982 > blob.by4prdstr03a.store.core.windows.net.http: Flags [S], seq 526870093, win 29200, options [mss 1460,sackOK,TS val 20900428 ecr 0,nop,wscale 7], length 0
19:40:40.945715 IP 10.0.0.5.49983 > blob.by4prdstr03a.store.core.windows.net.http: Flags [S], seq 1807176109, win 29200, options [mss 1460,sackOK,TS val 20900639 ecr 0,nop,wscale 7], length 0
19:40:41.442352 IP 10.0.0.5.49984 > blob.by4prdstr03a.store.core.windows.net.http: Flags [S], seq 2640054518, win 29200, options [mss 1460,sackOK,TS val 20900763 ecr 0,nop,wscale 7], length 0
19:40:41.984807 IP 10.0.0.5.49986 > blob.by4prdstr03a.store.core.windows.net.http: Flags [S], seq 1186715437, win 29200, options [mss 1460,sackOK,TS val 20900899 ecr 0,nop,wscale 7], length 0
