19:39:01.972675 IP 10.0.0.5.49750 > blob.by4prdstr03a.store.core.windows.net.http: Flags [S], seq 2022989647, win 29200, options [mss 1460,sackOK,TS val 20875896 ecr 0,nop,wscale 7], length 0
19:39:02.010536 IP blob.by4prdstr03a.store.core.windows.net.http > 10.0.0.5.49750: Flags [S.], seq 909808302, ack 2022989648, win 8192, options [mss 1440,nop,wscale 8,sackOK,TS val 253666243 ecr 20875896], length 0
19:39:02.409805 IP 10.0.0.5.49751 > blob.by4prdstr03a.store.core.windows.net.http: Flags [S], seq 1238777422, win 29200, options [mss 1460,sackOK,TS val 20876005 ecr 0,nop,wscale 7], length 0
19:39:02.449507 IP blob.by4prdstr03a.store.core.windows.net.http > 10.0.0.5.49751: Flags [S.], seq 551815351, ack 1238777423, win 8192, options [mss 1440,nop,wscale 8,sackOK,TS val 1786257 ecr 20876005], length 0
19:39:02.850712 IP 10.0.0.5.49752 > blob.by4prdstr03a.store.core.windows.net.http: Flags [S], seq 404026491, win 29200, options [mss 1460,sackOK,TS val 20876115 ecr 0,nop,wscale 7], length 0
19:39:02.888681 IP blob.by4prdstr03a.store.core.windows.net.http > 10.0.0.5.49752: Flags [S.], seq 3044760159, ack 404026492, win 8192, options [mss 1440,nop,wscale 8,sackOK,TS val 255288053 ecr 20876115], length 0
19:39:03.305552 IP 10.0.0.5.49753 > blob.by4prdstr03a.store.core.windows.net.http: Flags [S], seq 1667997206, win 29200, options [mss 1460,sackOK,TS val 20876229 ecr 0,nop,wscale 7], length 0
19:39:03.343625 IP blob.by4prdstr03a.store.core.windows.net.http > 10.0.0.5.49753: Flags [S.], seq 60333383, ack 1667997207, win 8192, options [mss 1440,nop,wscale 8,sackOK,TS val 251467366 ecr 20876229], length 0
19:39:03.770171 IP 10.0.0.5.49755 > blob.by4prdstr03a.store.core.windows.net.http: Flags [S], seq 3548123324, win 29200, options [mss 1460,sackOK,TS val 20876345 ecr 0,nop,wscale 7], length 0
19:39:03.809915 IP blob.by4prdstr03a.store.core.windows.net.http > 10.0.0.5.49755: Flags [S.], seq 202611843, ack 3548123325, win 8192, options [mss 1440,nop,wscale 8,sackOK,TS val 248512557 ecr 20876345], length 0
19:39:04.209163 IP 10.0.0.5.49758 > blob.by4prdstr03a.store.core.windows.net.http: Flags [S], seq 2837637330, win 29200, options [mss 1460,sackOK,TS val 20876455 ecr 0,nop,wscale 7], length 0
19:39:04.246978 IP blob.by4prdstr03a.store.core.windows.net.http > 10.0.0.5.49758: Flags [S.], seq 2086348540, ack 2837637331, win 8192, options [mss 1440,nop,wscale 8,sackOK,TS val 248509474 ecr 20876455], length 0
19:39:04.641950 IP 10.0.0.5.49760 > blob.by4prdstr03a.store.core.windows.net.http: Flags [S], seq 3104547662, win 29200, options [mss 1460,sackOK,TS val 20876563 ecr 0,nop,wscale 7], length 0
19:39:04.679987 IP blob.by4prdstr03a.store.core.windows.net.http > 10.0.0.5.49760: Flags [S.], seq 3054937189, ack 3104547663, win 8192, options [mss 1440,nop,wscale 8,sackOK,TS val 255282684 ecr 20876563], length 0
19:39:05.081000 IP 10.0.0.5.49761 > blob.by4prdstr03a.store.core.windows.net.http: Flags [S], seq 3145758878, win 29200, options [mss 1460,sackOK,TS val 20876673 ecr 0,nop,wscale 7], length 0
19:39:05.119058 IP blob.by4prdstr03a.store.core.windows.net.http > 10.0.0.5.49761: Flags [S.], seq 1496757476, ack 3145758879, win 8192, options [mss 1440,nop,wscale 8,sackOK,TS val 249361670 ecr 20876673], length 0
19:39:05.524069 IP 10.0.0.5.49762 > blob.by4prdstr03a.store.core.windows.net.http: Flags [S], seq 3633931969, win 29200, options [mss 1460,sackOK,TS val 20876784 ecr 0,nop,wscale 7], length 0
19:39:05.562016 IP blob.by4prdstr03a.store.core.windows.net.http > 10.0.0.5.49762: Flags [S.], seq 3685096597, ack 3633931970, win 8192, options [mss 1440,nop,wscale 8,sackOK,TS val 254404966 ecr 20876784], length 0
19:39:05.960514 IP 10.0.0.5.49763 > blob.by4prdstr03a.store.core.windows.net.http: Flags [S], seq 232746431, win 29200, options [mss 1460,sackOK,TS val 20876893 ecr 0,nop,wscale 7], length 0
19:39:06.000112 IP blob.by4prdstr03a.store.core.windows.net.http > 10.0.0.5.49763: Flags [S.], seq 2725512900, ack 232746432, win 8192, options [mss 1440,nop,wscale 8,sackOK,TS val 250809089 ecr 20876893], length 0
19:39:06.432983 IP 10.0.0.5.49764 > blob.by4prdstr03a.store.core.windows.net.http: Flags [S], seq 908932965, win 29200, options [mss 1460,sackOK,TS val 20877011 ecr 0,nop,wscale 7], length 0
19:39:06.470933 IP blob.by4prdstr03a.store.core.windows.net.http > 10.0.0.5.49764: Flags [S.], seq 2779144278, ack 908932966, win 8192, options [mss 1440,nop,wscale 8,sackOK,TS val 239266559 ecr 20877011], length 0
19:39:06.903960 IP 10.0.0.5.49766 > blob.by4prdstr03a.store.core.windows.net.http: Flags [S], seq 1757610662, win 29200, options [mss 1460,sackOK,TS val 20877129 ecr 0,nop,wscale 7], length 0
19:39:06.941853 IP blob.by4prdstr03a.store.core.windows.net.http > 10.0.0.5.49766: Flags [S.], seq 1875541768, ack 1757610663, win 8192, options [mss 1440,nop,wscale 8,sackOK,TS val 255294187 ecr 20877129], length 0
19:39:07.144269 IP 10.0.0.5.46971 > blob.dm3prdstp05c.store.core.windows.net.https: Flags [S], seq 3955966735, win 29200, options [mss 1460,sackOK,TS val 20877189 ecr 0,nop,wscale 7], length 0
19:39:07.144709 IP blob.dm3prdstp05c.store.core.windows.net.https > 10.0.0.5.46971: Flags [S.], seq 3834114719, ack 3955966736, win 8192, options [mss 1440,nop,wscale 8,sackOK,TS val 247760516 ecr 20877189], length 0
19:39:07.156802 IP 10.0.0.5.46972 > blob.dm3prdstp05c.store.core.windows.net.https: Flags [S], seq 839256831, win 29200, options [mss 1460,sackOK,TS val 20877192 ecr 0,nop,wscale 7], length 0
19:39:07.157162 IP blob.dm3prdstp05c.store.core.windows.net.https > 10.0.0.5.46972: Flags [S.], seq 2686786263, ack 839256832, win 8192, options [mss 1440,nop,wscale 8,sackOK,TS val 247394746 ecr 20877192], length 0
19:39:07.169492 IP 10.0.0.5.46973 > blob.dm3prdstp05c.store.core.windows.net.https: Flags [S], seq 35256882, win 29200, options [mss 1460,sackOK,TS val 20877195 ecr 0,nop,wscale 7], length 0
19:39:07.169758 IP blob.dm3prdstp05c.store.core.windows.net.https > 10.0.0.5.46973: Flags [S.], seq 3495775537, ack 35256883, win 8192, options [mss 1440,nop,wscale 8,sackOK,TS val 249759690 ecr 20877195], length 0
19:39:07.373236 IP 10.0.0.5.49771 > blob.by4prdstr03a.store.core.windows.net.http: Flags [S], seq 1844088590, win 29200, options [mss 1460,sackOK,TS val 20877246 ecr 0,nop,wscale 7], length 0
19:39:07.411021 IP blob.by4prdstr03a.store.core.windows.net.http > 10.0.0.5.49771: Flags [S.], seq 147474800, ack 1844088591, win 8192, options [mss 1440,nop,wscale 8,sackOK,TS val 239283447 ecr 20877246], length 0
19:39:07.798872 IP 10.0.0.5.49772 > blob.by4prdstr03a.store.core.windows.net.http: Flags [S], seq 5103987, win 29200, options [mss 1460,sackOK,TS val 20877352 ecr 0,nop,wscale 7], length 0
19:39:07.836762 IP blob.by4prdstr03a.store.core.windows.net.http > 10.0.0.5.49772: Flags [S.], seq 3244562285, ack 5103988, win 8192, options [mss 1440,nop,wscale 8,sackOK,TS val 253680063 ecr 20877352], length 0
19:39:08.278061 IP 10.0.0.5.49773 > blob.by4prdstr03a.store.core.windows.net.http: Flags [S], seq 2490360913, win 29200, options [mss 1460,sackOK,TS val 20877472 ecr 0,nop,wscale 7], length 0
19:39:08.315984 IP blob.by4prdstr03a.store.core.windows.net.http > 10.0.0.5.49773: Flags [S.], seq 2761483348, ack 2490360914, win 8192, options [mss 1440,nop,wscale 8,sackOK,TS val 14109163 ecr 20877472], length 0
19:39:08.701290 IP 10.0.0.5.49774 > blob.by4prdstr03a.store.core.windows.net.http: Flags [S], seq 2557402571, win 29200, options [mss 1460,sackOK,TS val 20877578 ecr 0,nop,wscale 7], length 0
19:39:08.739229 IP blob.by4prdstr03a.store.core.windows.net.http > 10.0.0.5.49774: Flags [S.], seq 838346299, ack 2557402572, win 8192, options [mss 1440,nop,wscale 8,sackOK,TS val 253669610 ecr 20877578], length 0
19:39:09.163709 IP 10.0.0.5.49775 > blob.by4prdstr03a.store.core.windows.net.http: Flags [S], seq 962409113, win 29200, options [mss 1460,sackOK,TS val 20877694 ecr 0,nop,wscale 7], length 0
19:39:09.201699 IP blob.by4prdstr03a.store.core.windows.net.http > 10.0.0.5.49775: Flags [S.], seq 1430474780, ack 962409114, win 8192, options [mss 1440,nop,wscale 8,sackOK,TS val 254414373 ecr 20877694], length 0
19:39:09.638438 IP 10.0.0.5.49776 > blob.by4prdstr03a.store.core.windows.net.http: Flags [S], seq 2276798101, win 29200, options [mss 1460,sackOK,TS val 20877812 ecr 0,nop,wscale 7], length 0
19:39:09.676318 IP blob.by4prdstr03a.store.core.windows.net.http > 10.0.0.5.49776: Flags [S.], seq 3874664000, ack 2276798102, win 8192, options [mss 1440,nop,wscale 8,sackOK,TS val 251490264 ecr 20877812], length 0
19:39:10.065224 IP 10.0.0.5.49777 > blob.by4prdstr03a.store.core.windows.net.http: Flags [S], seq 205751694, win 29200, options [mss 1460,sackOK,TS val 20877919 ecr 0,nop,wscale 7], length 0
19:39:10.103012 IP blob.by4prdstr03a.store.core.windows.net.http > 10.0.0.5.49777: Flags [S.], seq 1661232878, ack 205751695, win 8192, options [mss 1440,nop,wscale 8,sackOK,TS val 256031897 ecr 20877919], length 0
19:39:10.492973 IP 10.0.0.5.49778 > blob.by4prdstr03a.store.core.windows.net.http: Flags [S], seq 1354269602, win 29200, options [mss 1460,sackOK,TS val 20878026 ecr 0,nop,wscale 7], length 0
19:39:10.531319 IP blob.by4prdstr03a.store.core.windows.net.http > 10.0.0.5.49778: Flags [S.], seq 4151567716, ack 1354269603, win 8192, options [mss 1440,nop,wscale 8,sackOK,TS val 125834037 ecr 20878026], length 0
19:39:10.915303 IP 10.0.0.5.49779 > blob.by4prdstr03a.store.core.windows.net.http: Flags [S], seq 3825853051, win 29200, options [mss 1460,sackOK,TS val 20878132 ecr 0,nop,wscale 7], length 0
19:39:10.953199 IP blob.by4prdstr03a.store.core.windows.net.http > 10.0.0.5.49779: Flags [S.], seq 588920989, ack 3825853052, win 8192, options [mss 1440,nop,wscale 8,sackOK,TS val 1667568 ecr 20878132], length 0
19:39:11.363501 IP 10.0.0.5.49780 > blob.by4prdstr03a.store.core.windows.net.http: Flags [S], seq 724663044, win 29200, options [mss 1460,sackOK,TS val 20878244 ecr 0,nop,wscale 7], length 0
19:39:11.401415 IP blob.by4prdstr03a.store.core.windows.net.http > 10.0.0.5.49780: Flags [S.], seq 3914808386, ack 724663045, win 8192, options [mss 1440,nop,wscale 8,sackOK,TS val 250793491 ecr 20878244], length 0
19:39:11.948201 IP 10.0.0.5.49781 > blob.by4prdstr03a.store.core.windows.net.http: Flags [S], seq 313303727, win 29200, options [mss 1460,sackOK,TS val 20878390 ecr 0,nop,wscale 7], length 0
19:39:11.986029 IP blob.by4prdstr03a.store.core.windows.net.http > 10.0.0.5.49781: Flags [S.], seq 3905821603, ack 313303728, win 8192, options [mss 1440,nop,wscale 8,sackOK,TS val 20431699 ecr 20878390], length 0
19:39:12.375843 IP 10.0.0.5.49782 > blob.by4prdstr03a.store.core.windows.net.http: Flags [S], seq 908348769, win 29200, options [mss 1460,sackOK,TS val 20878497 ecr 0,nop,wscale 7], length 0
19:39:12.413600 IP blob.by4prdstr03a.store.core.windows.net.http > 10.0.0.5.49782: Flags [S.], seq 3233658823, ack 908348770, win 8192, options [mss 1440,nop,wscale 8,sackOK,TS val 254409246 ecr 20878497], length 0
19:39:12.864317 IP 10.0.0.5.49783 > blob.by4prdstr03a.store.core.windows.net.http: Flags [S], seq 2587977232, win 29200, options [mss 1460,sackOK,TS val 20878619 ecr 0,nop,wscale 7], length 0
19:39:12.902066 IP blob.by4prdstr03a.store.core.windows.net.http > 10.0.0.5.49783: Flags [S.], seq 3832348800, ack 2587977233, win 8192, options [mss 1440,nop,wscale 8,sackOK,TS val 252127923 ecr 20878619], length 0
19:39:13.507112 IP 10.0.0.5.49784 > blob.by4prdstr03a.store.core.windows.net.http: Flags [S], seq 419065472, win 29200, options [mss 1460,sackOK,TS val 20878780 ecr 0,nop,wscale 7], length 0
19:39:13.545033 IP blob.by4prdstr03a.store.core.windows.net.http > 10.0.0.5.49784: Flags [S.], seq 1625607338, ack 419065473, win 8192, options [mss 1440,nop,wscale 8,sackOK,TS val 254421474 ecr 20878780], length 0
19:39:14.007871 IP 10.0.0.5.49785 > blob.by4prdstr03a.store.core.windows.net.http: Flags [S], seq 3246573431, win 29200, options [mss 1460,sackOK,TS val 20878905 ecr 0,nop,wscale 7], length 0
19:39:14.046568 IP blob.by4prdstr03a.store.core.windows.net.http > 10.0.0.5.49785: Flags [S.], seq 2220956476, ack 3246573432, win 8192, options [mss 1440,nop,wscale 8,sackOK,TS val 251466504 ecr 20878905], length 0
19:39:14.504616 IP 10.0.0.5.49786 > blob.by4prdstr03a.store.core.windows.net.http: Flags [S], seq 2101850297, win 29200, options [mss 1460,sackOK,TS val 20879029 ecr 0,nop,wscale 7], length 0
19:39:14.542408 IP blob.by4prdstr03a.store.core.windows.net.http > 10.0.0.5.49786: Flags [S.], seq 1594527811, ack 2101850298, win 8192, options [mss 1440,nop,wscale 8,sackOK,TS val 253665378 ecr 20879029], length 0
19:39:14.965426 IP 10.0.0.5.49787 > blob.by4prdstr03a.store.core.windows.net.http: Flags [S], seq 3020260124, win 29200, options [mss 1460,sackOK,TS val 20879144 ecr 0,nop,wscale 7], length 0
19:39:15.003292 IP blob.by4prdstr03a.store.core.windows.net.http > 10.0.0.5.49787: Flags [S.], seq 102555957, ack 3020260125, win 8192, options [mss 1440,nop,wscale 8,sackOK,TS val 256010221 ecr 20879144], length 0
19:39:15.397467 IP 10.0.0.5.49788 > blob.by4prdstr03a.store.core.windows.net.http: Flags [S], seq 1293839045, win 29200, options [mss 1460,sackOK,TS val 20879252 ecr 0,nop,wscale 7], length 0
19:39:15.435366 IP blob.by4prdstr03a.store.core.windows.net.http > 10.0.0.5.49788: Flags [S.], seq 731971757, ack 1293839046, win 8192, options [mss 1440,nop,wscale 8,sackOK,TS val 250071162 ecr 20879252], length 0
19:39:15.834773 IP 10.0.0.5.49789 > blob.by4prdstr03a.store.core.windows.net.http: Flags [S], seq 663159285, win 29200, options [mss 1460,sackOK,TS val 20879361 ecr 0,nop,wscale 7], length 0
19:39:15.872662 IP blob.by4prdstr03a.store.core.windows.net.http > 10.0.0.5.49789: Flags [S.], seq 1929791211, ack 663159286, win 8192, options [mss 1440,nop,wscale 8,sackOK,TS val 8785226 ecr 20879361], length 0
19:39:16.294775 IP 10.0.0.5.49790 > blob.by4prdstr03a.store.core.windows.net.http: Flags [S], seq 2356770621, win 29200, options [mss 1460,sackOK,TS val 20879476 ecr 0,nop,wscale 7], length 0
19:39:16.332633 IP blob.by4prdstr03a.store.core.windows.net.http > 10.0.0.5.49790: Flags [S.], seq 2199244280, ack 2356770622, win 8192, options [mss 1440,nop,wscale 8,sackOK,TS val 13149749 ecr 20879476], length 0
19:39:16.736649 IP 10.0.0.5.49791 > blob.by4prdstr03a.store.core.windows.net.http: Flags [S], seq 1279340290, win 29200, options [mss 1460,sackOK,TS val 20879587 ecr 0,nop,wscale 7], length 0
19:39:16.884521 IP blob.by4prdstr03a.store.core.windows.net.http > 10.0.0.5.49791: Flags [S.], seq 1189344457, ack 1279340291, win 8192, options [mss 1440,nop,wscale 8,sackOK,TS val 240520134 ecr 20879587], length 0
19:39:18.536074 IP 10.0.0.5.49792 > blob.by4prdstr03a.store.core.windows.net.http: Flags [S], seq 2031637851, win 29200, options [mss 1460,sackOK,TS val 20880037 ecr 0,nop,wscale 7], length 0
19:39:18.573929 IP blob.by4prdstr03a.store.core.windows.net.http > 10.0.0.5.49792: Flags [S.], seq 318482250, ack 2031637852, win 8192, options [mss 1440,nop,wscale 8,sackOK,TS val 4058387 ecr 20880037], length 0
19:39:19.027895 IP 10.0.0.5.49793 > blob.by4prdstr03a.store.core.windows.net.http: Flags [S], seq 3591114797, win 29200, options [mss 1460,sackOK,TS val 20880160 ecr 0,nop,wscale 7], length 0
19:39:19.065883 IP blob.by4prdstr03a.store.core.windows.net.http > 10.0.0.5.49793: Flags [S.], seq 3061112071, ack 3591114798, win 8192, options [mss 1440,nop,wscale 8,sackOK,TS val 252954031 ecr 20880160], length 0
19:39:19.445551 IP 10.0.0.5.49794 > blob.by4prdstr03a.store.core.windows.net.http: Flags [S], seq 3468559834, win 29200, options [mss 1460,sackOK,TS val 20880264 ecr 0,nop,wscale 7], length 0
19:39:19.483274 IP blob.by4prdstr03a.store.core.windows.net.http > 10.0.0.5.49794: Flags [S.], seq 2498673454, ack 3468559835, win 8192, options [mss 1440,nop,wscale 8,sackOK,TS val 254423416 ecr 20880264], length 0
19:39:19.913623 IP 10.0.0.5.49795 > blob.by4prdstr03a.store.core.windows.net.http: Flags [S], seq 2322541822, win 29200, options [mss 1460,sackOK,TS val 20880381 ecr 0,nop,wscale 7], length 0
19:39:19.951321 IP blob.by4prdstr03a.store.core.windows.net.http > 10.0.0.5.49795: Flags [S.], seq 1695776489, ack 2322541823, win 8192, options [mss 1440,nop,wscale 8,sackOK,TS val 3105055 ecr 20880381], length 0
19:39:20.349998 IP 10.0.0.5.49796 > blob.by4prdstr03a.store.core.windows.net.http: Flags [S], seq 1206841689, win 29200, options [mss 1460,sackOK,TS val 20880490 ecr 0,nop,wscale 7], length 0
19:39:20.387793 IP blob.by4prdstr03a.store.core.windows.net.http > 10.0.0.5.49796: Flags [S.], seq 4022537499, ack 1206841690, win 8192, options [mss 1440,nop,wscale 8,sackOK,TS val 255218463 ecr 20880490], length 0
19:39:20.823531 IP 10.0.0.5.49797 > blob.by4prdstr03a.store.core.windows.net.http: Flags [S], seq 2598900134, win 29200, options [mss 1460,sackOK,TS val 20880609 ecr 0,nop,wscale 7], length 0
19:39:20.861516 IP blob.by4prdstr03a.store.core.windows.net.http > 10.0.0.5.49797: Flags [S.], seq 4066914096, ack 2598900135, win 8192, options [mss 1440,nop,wscale 8,sackOK,TS val 21920079 ecr 20880609], length 0
19:39:21.257580 IP 10.0.0.5.49798 > blob.by4prdstr03a.store.core.windows.net.http: Flags [S], seq 1698693539, win 29200, options [mss 1460,sackOK,TS val 20880717 ecr 0,nop,wscale 7], length 0
19:39:21.295362 IP blob.by4prdstr03a.store.core.windows.net.http > 10.0.0.5.49798: Flags [S.], seq 227026258, ack 1698693540, win 8192, options [mss 1440,nop,wscale 8,sackOK,TS val 3298568 ecr 20880717], length 0
19:39:21.696081 IP 10.0.0.5.49799 > blob.by4prdstr03a.store.core.windows.net.http: Flags [S], seq 2479486292, win 29200, options [mss 1460,sackOK,TS val 20880827 ecr 0,nop,wscale 7], length 0
19:39:21.733983 IP blob.by4prdstr03a.store.core.windows.net.http > 10.0.0.5.49799: Flags [S.], seq 2124620037, ack 2479486293, win 8192, options [mss 1440,nop,wscale 8,sackOK,TS val 254400023 ecr 20880827], length 0
19:39:22.148707 IP 10.0.0.5.49800 > blob.by4prdstr03a.store.core.windows.net.http: Flags [S], seq 2523394994, win 29200, options [mss 1460,sackOK,TS val 20880940 ecr 0,nop,wscale 7], length 0
19:39:22.186603 IP blob.by4prdstr03a.store.core.windows.net.http > 10.0.0.5.49800: Flags [S.], seq 125962879, ack 2523394995, win 8192, options [mss 1440,nop,wscale 8,sackOK,TS val 255994652 ecr 20880940], length 0
19:39:22.593146 IP 10.0.0.5.49801 > blob.by4prdstr03a.store.core.windows.net.http: Flags [S], seq 241451447, win 29200, options [mss 1460,sackOK,TS val 20881051 ecr 0,nop,wscale 7], length 0
19:39:22.630967 IP blob.by4prdstr03a.store.core.windows.net.http > 10.0.0.5.49801: Flags [S.], seq 1590944532, ack 241451448, win 8192, options [mss 1440,nop,wscale 8,sackOK,TS val 253668986 ecr 20881051], length 0
19:39:23.197301 IP 10.0.0.5.49802 > blob.by4prdstr03a.store.core.windows.net.http: Flags [S], seq 2243659611, win 29200, options [mss 1460,sackOK,TS val 20881202 ecr 0,nop,wscale 7], length 0
19:39:23.235227 IP blob.by4prdstr03a.store.core.windows.net.http > 10.0.0.5.49802: Flags [S.], seq 61466337, ack 2243659612, win 8192, options [mss 1440,nop,wscale 8,sackOK,TS val 256017629 ecr 20881202], length 0
19:39:23.655434 IP 10.0.0.5.49803 > blob.by4prdstr03a.store.core.windows.net.http: Flags [S], seq 2465408535, win 29200, options [mss 1460,sackOK,TS val 20881317 ecr 0,nop,wscale 7], length 0
19:39:23.693469 IP blob.by4prdstr03a.store.core.windows.net.http > 10.0.0.5.49803: Flags [S.], seq 3716398525, ack 2465408536, win 8192, options [mss 1440,nop,wscale 8,sackOK,TS val 250079667 ecr 20881317], length 0
19:39:24.129262 IP 10.0.0.5.49804 > blob.by4prdstr03a.store.core.windows.net.http: Flags [S], seq 126099111, win 29200, options [mss 1460,sackOK,TS val 20881435 ecr 0,nop,wscale 7], length 0
19:39:24.167158 IP blob.by4prdstr03a.store.core.windows.net.http > 10.0.0.5.49804: Flags [S.], seq 3804168433, ack 126099112, win 8192, options [mss 1440,nop,wscale 8,sackOK,TS val 239263686 ecr 20881435], length 0
19:39:24.610900 IP 10.0.0.5.49805 > blob.by4prdstr03a.store.core.windows.net.http: Flags [S], seq 3666910426, win 29200, options [mss 1460,sackOK,TS val 20881555 ecr 0,nop,wscale 7], length 0
19:39:24.648696 IP blob.by4prdstr03a.store.core.windows.net.http > 10.0.0.5.49805: Flags [S.], seq 1025873573, ack 3666910427, win 8192, options [mss 1440,nop,wscale 8,sackOK,TS val 9949473 ecr 20881555], length 0
19:39:25.066999 IP 10.0.0.5.49806 > blob.by4prdstr03a.store.core.windows.net.http: Flags [S], seq 1965891300, win 29200, options [mss 1460,sackOK,TS val 20881670 ecr 0,nop,wscale 7], length 0
19:39:25.105036 IP blob.by4prdstr03a.store.core.windows.net.http > 10.0.0.5.49806: Flags [S.], seq 981782119, ack 1965891301, win 8192, options [mss 1440,nop,wscale 8,sackOK,TS val 252136569 ecr 20881670], length 0
19:39:25.537450 IP 10.0.0.5.49807 > blob.by4prdstr03a.store.core.windows.net.http: Flags [S], seq 3103516927, win 29200, options [mss 1460,sackOK,TS val 20881787 ecr 0,nop,wscale 7], length 0
19:39:25.575411 IP blob.by4prdstr03a.store.core.windows.net.http > 10.0.0.5.49807: Flags [S.], seq 1653999282, ack 3103516928, win 8192, options [mss 1440,nop,wscale 8,sackOK,TS val 252125863 ecr 20881787], length 0
19:39:25.983130 IP 10.0.0.5.49808 > blob.by4prdstr03a.store.core.windows.net.http: Flags [S], seq 2900324112, win 29200, options [mss 1460,sackOK,TS val 20881899 ecr 0,nop,wscale 7], length 0
19:39:26.021219 IP blob.by4prdstr03a.store.core.windows.net.http > 10.0.0.5.49808: Flags [S.], seq 546264299, ack 2900324113, win 8192, options [mss 1440,nop,wscale 8,sackOK,TS val 251481618 ecr 20881899], length 0
19:39:26.447972 IP 10.0.0.5.49809 > blob.by4prdstr03a.store.core.windows.net.http: Flags [S], seq 1112821198, win 29200, options [mss 1460,sackOK,TS val 20882015 ecr 0,nop,wscale 7], length 0
19:39:26.485969 IP blob.by4prdstr03a.store.core.windows.net.http > 10.0.0.5.49809: Flags [S.], seq 753223408, ack 1112821199, win 8192, options [mss 1440,nop,wscale 8,sackOK,TS val 239275603 ecr 20882015], length 0
19:39:26.918102 IP 10.0.0.5.49810 > blob.by4prdstr03a.store.core.windows.net.http: Flags [S], seq 1052724052, win 29200, options [mss 1460,sackOK,TS val 20882132 ecr 0,nop,wscale 7], length 0
19:39:26.955987 IP blob.by4prdstr03a.store.core.windows.net.http > 10.0.0.5.49810: Flags [S.], seq 3802753900, ack 1052724053, win 8192, options [mss 1440,nop,wscale 8,sackOK,TS val 11454199 ecr 20882132], length 0
19:39:27.397026 IP 10.0.0.5.49811 > blob.by4prdstr03a.store.core.windows.net.http: Flags [S], seq 1759388238, win 29200, options [mss 1460,sackOK,TS val 20882252 ecr 0,nop,wscale 7], length 0
19:39:27.435000 IP blob.by4prdstr03a.store.core.windows.net.http > 10.0.0.5.49811: Flags [S.], seq 4108535010, ack 1759388239, win 8192, options [mss 1440,nop,wscale 8,sackOK,TS val 256025352 ecr 20882252], length 0
19:39:27.825653 IP 10.0.0.5.49812 > blob.by4prdstr03a.store.core.windows.net.http: Flags [S], seq 1889095189, win 29200, options [mss 1460,sackOK,TS val 20882359 ecr 0,nop,wscale 7], length 0
19:39:27.863607 IP blob.by4prdstr03a.store.core.windows.net.http > 10.0.0.5.49812: Flags [S.], seq 1892436307, ack 1889095190, win 8192, options [mss 1440,nop,wscale 8,sackOK,TS val 249380487 ecr 20882359], length 0
19:39:28.281461 IP 10.0.0.5.49813 > blob.by4prdstr03a.store.core.windows.net.http: Flags [S], seq 1891148161, win 29200, options [mss 1460,sackOK,TS val 20882473 ecr 0,nop,wscale 7], length 0
19:39:28.319415 IP blob.by4prdstr03a.store.core.windows.net.http > 10.0.0.5.49813: Flags [S.], seq 2123196234, ack 1891148162, win 8192, options [mss 1440,nop,wscale 8,sackOK,TS val 255279173 ecr 20882473], length 0
19:39:28.719269 IP 10.0.0.5.49814 > blob.by4prdstr03a.store.core.windows.net.http: Flags [S], seq 2477072080, win 29200, options [mss 1460,sackOK,TS val 20882583 ecr 0,nop,wscale 7], length 0
19:39:28.757254 IP blob.by4prdstr03a.store.core.windows.net.http > 10.0.0.5.49814: Flags [S.], seq 3643878215, ack 2477072081, win 8192, options [mss 1440,nop,wscale 8,sackOK,TS val 254403410 ecr 20882583], length 0
19:39:29.199027 IP 10.0.0.5.49815 > blob.by4prdstr03a.store.core.windows.net.http: Flags [S], seq 1683577111, win 29200, options [mss 1460,sackOK,TS val 20882703 ecr 0,nop,wscale 7], length 0
19:39:29.236997 IP blob.by4prdstr03a.store.core.windows.net.http > 10.0.0.5.49815: Flags [S.], seq 2583765776, ack 1683577112, win 8192, options [mss 1440,nop,wscale 8,sackOK,TS val 250787851 ecr 20882703], length 0
19:39:29.820563 IP 10.0.0.5.49816 > blob.by4prdstr03a.store.core.windows.net.http: Flags [S], seq 972197028, win 29200, options [mss 1460,sackOK,TS val 20882858 ecr 0,nop,wscale 7], length 0
19:39:29.858551 IP blob.by4prdstr03a.store.core.windows.net.http > 10.0.0.5.49816: Flags [S.], seq 561222638, ack 972197029, win 8192, options [mss 1440,nop,wscale 8,sackOK,TS val 249355494 ecr 20882858], length 0
19:39:30.252928 IP 10.0.0.5.49817 > blob.by4prdstr03a.store.core.windows.net.http: Flags [S], seq 2190230081, win 29200, options [mss 1460,sackOK,TS val 20882966 ecr 0,nop,wscale 7], length 0
19:39:30.290732 IP blob.by4prdstr03a.store.core.windows.net.http > 10.0.0.5.49817: Flags [S.], seq 3937280388, ack 2190230082, win 8192, options [mss 1440,nop,wscale 8,sackOK,TS val 251487608 ecr 20882966], length 0
19:39:30.676690 IP 10.0.0.5.49818 > blob.by4prdstr03a.store.core.windows.net.http: Flags [S], seq 3126192266, win 29200, options [mss 1460,sackOK,TS val 20883072 ecr 0,nop,wscale 7], length 0
19:39:30.714619 IP blob.by4prdstr03a.store.core.windows.net.http > 10.0.0.5.49818: Flags [S.], seq 3147440343, ack 3126192267, win 8192, options [mss 1440,nop,wscale 8,sackOK,TS val 252135710 ecr 20883072], length 0
19:39:31.189960 IP 10.0.0.5.49819 > blob.by4prdstr03a.store.core.windows.net.http: Flags [S], seq 1380185213, win 29200, options [mss 1460,sackOK,TS val 20883200 ecr 0,nop,wscale 7], length 0
19:39:31.227989 IP blob.by4prdstr03a.store.core.windows.net.http > 10.0.0.5.49819: Flags [S.], seq 676544419, ack 1380185214, win 8192, options [mss 1440,nop,wscale 8,sackOK,TS val 256002629 ecr 20883200], length 0
19:39:31.785715 IP 10.0.0.5.49820 > blob.by4prdstr03a.store.core.windows.net.http: Flags [S], seq 568673371, win 29200, options [mss 1460,sackOK,TS val 20883349 ecr 0,nop,wscale 7], length 0
19:39:31.823610 IP blob.by4prdstr03a.store.core.windows.net.http > 10.0.0.5.49820: Flags [S.], seq 3727269820, ack 568673372, win 8192, options [mss 1440,nop,wscale 8,sackOK,TS val 252134450 ecr 20883349], length 0
19:39:32.207614 IP 10.0.0.5.49821 > blob.by4prdstr03a.store.core.windows.net.http: Flags [S], seq 2295540732, win 29200, options [mss 1460,sackOK,TS val 20883455 ecr 0,nop,wscale 7], length 0
19:39:32.245486 IP blob.by4prdstr03a.store.core.windows.net.http > 10.0.0.5.49821: Flags [S.], seq 3502869723, ack 2295540733, win 8192, options [mss 1440,nop,wscale 8,sackOK,TS val 2304339 ecr 20883455], length 0
19:39:32.310774 IP 10.0.0.5.47026 > blob.dm3prdstp05c.store.core.windows.net.https: Flags [S], seq 1689953703, win 29200, options [mss 1460,sackOK,TS val 20883480 ecr 0,nop,wscale 7], length 0
19:39:32.311172 IP blob.dm3prdstp05c.store.core.windows.net.https > 10.0.0.5.47026: Flags [S.], seq 3984122699, ack 1689953704, win 8192, options [mss 1440,nop,wscale 8,sackOK,TS val 248501808 ecr 20883480], length 0
19:39:32.323529 IP 10.0.0.5.47027 > blob.dm3prdstp05c.store.core.windows.net.https: Flags [S], seq 1507198613, win 29200, options [mss 1460,sackOK,TS val 20883484 ecr 0,nop,wscale 7], length 0
19:39:32.323967 IP blob.dm3prdstp05c.store.core.windows.net.https > 10.0.0.5.47027: Flags [S.], seq 2068733460, ack 1507198614, win 8192, options [mss 1440,nop,wscale 8,sackOK,TS val 247032665 ecr 20883484], length 0
19:39:32.337253 IP 10.0.0.5.47028 > blob.dm3prdstp05c.store.core.windows.net.https: Flags [S], seq 3357374596, win 29200, options [mss 1460,sackOK,TS val 20883487 ecr 0,nop,wscale 7], length 0
19:39:32.337734 IP blob.dm3prdstp05c.store.core.windows.net.https > 10.0.0.5.47028: Flags [S.], seq 1064532184, ack 3357374597, win 8192, options [mss 1440,nop,wscale 8,sackOK,TS val 248869302 ecr 20883487], length 0
19:39:32.686356 IP 10.0.0.5.49826 > blob.by4prdstr03a.store.core.windows.net.http: Flags [S], seq 1104574417, win 29200, options [mss 1460,sackOK,TS val 20883574 ecr 0,nop,wscale 7], length 0
19:39:32.724668 IP blob.by4prdstr03a.store.core.windows.net.http > 10.0.0.5.49826: Flags [S.], seq 2625450282, ack 1104574418, win 8192, options [mss 1440,nop,wscale 8,sackOK,TS val 252960528 ecr 20883574], length 0
19:39:33.112332 IP 10.0.0.5.49827 > blob.by4prdstr03a.store.core.windows.net.http: Flags [S], seq 3946102742, win 29200, options [mss 1460,sackOK,TS val 20883681 ecr 0,nop,wscale 7], length 0
19:39:33.150372 IP blob.by4prdstr03a.store.core.windows.net.http > 10.0.0.5.49827: Flags [S.], seq 1872018741, ack 3946102743, win 8192, options [mss 1440,nop,wscale 8,sackOK,TS val 239268597 ecr 20883681], length 0
19:39:33.603012 IP 10.0.0.5.49828 > blob.by4prdstr03a.store.core.windows.net.http: Flags [S], seq 2107137060, win 29200, options [mss 1460,sackOK,TS val 20883804 ecr 0,nop,wscale 7], length 0
19:39:33.640964 IP blob.by4prdstr03a.store.core.windows.net.http > 10.0.0.5.49828: Flags [S.], seq 893138641, ack 2107137061, win 8192, options [mss 1440,nop,wscale 8,sackOK,TS val 250803015 ecr 20883804], length 0
19:39:34.029068 IP 10.0.0.5.49829 > blob.by4prdstr03a.store.core.windows.net.http: Flags [S], seq 776492755, win 29200, options [mss 1460,sackOK,TS val 20883910 ecr 0,nop,wscale 7], length 0
19:39:34.066933 IP blob.by4prdstr03a.store.core.windows.net.http > 10.0.0.5.49829: Flags [S.], seq 2056131730, ack 776492756, win 8192, options [mss 1440,nop,wscale 8,sackOK,TS val 16860148 ecr 20883910], length 0
19:39:34.513629 IP 10.0.0.5.49830 > blob.by4prdstr03a.store.core.windows.net.http: Flags [S], seq 1088777609, win 29200, options [mss 1460,sackOK,TS val 20884031 ecr 0,nop,wscale 7], length 0
19:39:34.551523 IP blob.by4prdstr03a.store.core.windows.net.http > 10.0.0.5.49830: Flags [S.], seq 1345974541, ack 1088777610, win 8192, options [mss 1440,nop,wscale 8,sackOK,TS val 255997141 ecr 20884031], length 0
19:39:35.079351 IP 10.0.0.5.49831 > blob.by4prdstr03a.store.core.windows.net.http: Flags [S], seq 538629688, win 29200, options [mss 1460,sackOK,TS val 20884173 ecr 0,nop,wscale 7], length 0
19:39:35.117397 IP blob.by4prdstr03a.store.core.windows.net.http > 10.0.0.5.49831: Flags [S.], seq 1341767791, ack 538629689, win 8192, options [mss 1440,nop,wscale 8,sackOK,TS val 248512764 ecr 20884173], length 0
19:39:35.502768 IP 10.0.0.5.49832 > blob.by4prdstr03a.store.core.windows.net.http: Flags [S], seq 1575611334, win 29200, options [mss 1460,sackOK,TS val 20884278 ecr 0,nop,wscale 7], length 0
19:39:35.540721 IP blob.by4prdstr03a.store.core.windows.net.http > 10.0.0.5.49832: Flags [S.], seq 1987374207, ack 1575611335, win 8192, options [mss 1440,nop,wscale 8,sackOK,TS val 248510939 ecr 20884278], length 0
19:39:35.934378 IP 10.0.0.5.49833 > blob.by4prdstr03a.store.core.windows.net.http: Flags [S], seq 4110231869, win 29200, options [mss 1460,sackOK,TS val 20884386 ecr 0,nop,wscale 7], length 0
19:39:35.972291 IP blob.by4prdstr03a.store.core.windows.net.http > 10.0.0.5.49833: Flags [S.], seq 3614030038, ack 4110231870, win 8192, options [mss 1440,nop,wscale 8,sackOK,TS val 239267020 ecr 20884386], length 0
19:39:36.378523 IP 10.0.0.5.49834 > blob.by4prdstr03a.store.core.windows.net.http: Flags [S], seq 3793369455, win 29200, options [mss 1460,sackOK,TS val 20884497 ecr 0,nop,wscale 7], length 0
19:39:36.416407 IP blob.by4prdstr03a.store.core.windows.net.http > 10.0.0.5.49834: Flags [S.], seq 1434866353, ack 3793369456, win 8192, options [mss 1440,nop,wscale 8,sackOK,TS val 250085963 ecr 20884497], length 0
19:39:36.830327 IP 10.0.0.5.49835 > blob.by4prdstr03a.store.core.windows.net.http: Flags [S], seq 3098056233, win 29200, options [mss 1460,sackOK,TS val 20884610 ecr 0,nop,wscale 7], length 0
19:39:36.868790 IP blob.by4prdstr03a.store.core.windows.net.http > 10.0.0.5.49835: Flags [S.], seq 3899250779, ack 3098056234, win 8192, options [mss 1440,nop,wscale 8,sackOK,TS val 253679068 ecr 20884610], length 0
19:39:37.328189 IP 10.0.0.5.49836 > blob.by4prdstr03a.store.core.windows.net.http: Flags [S], seq 4263833981, win 29200, options [mss 1460,sackOK,TS val 20884735 ecr 0,nop,wscale 7], length 0
19:39:37.366043 IP blob.by4prdstr03a.store.core.windows.net.http > 10.0.0.5.49836: Flags [S.], seq 1969856813, ack 4263833982, win 8192, options [mss 1440,nop,wscale 8,sackOK,TS val 255099606 ecr 20884735], length 0
19:39:37.833793 IP 10.0.0.5.49838 > blob.by4prdstr03a.store.core.windows.net.http: Flags [S], seq 294333956, win 29200, options [mss 1460,sackOK,TS val 20884861 ecr 0,nop,wscale 7], length 0
19:39:37.885170 IP blob.by4prdstr03a.store.core.windows.net.http > 10.0.0.5.49838: Flags [S.], seq 756723357, ack 294333957, win 8192, options [mss 1440,nop,wscale 8,sackOK,TS val 249370560 ecr 20884861], length 0
19:39:38.316929 IP 10.0.0.5.49839 > blob.by4prdstr03a.store.core.windows.net.http: Flags [S], seq 3789188824, win 29200, options [mss 1460,sackOK,TS val 20884982 ecr 0,nop,wscale 7], length 0
19:39:38.354960 IP blob.by4prdstr03a.store.core.windows.net.http > 10.0.0.5.49839: Flags [S.], seq 1532161231, ack 3789188825, win 8192, options [mss 1440,nop,wscale 8,sackOK,TS val 250805336 ecr 20884982], length 0
19:39:38.801885 IP 10.0.0.5.49841 > blob.by4prdstr03a.store.core.windows.net.http: Flags [S], seq 3817263868, win 29200, options [mss 1460,sackOK,TS val 20885103 ecr 0,nop,wscale 7], length 0
19:39:38.839889 IP blob.by4prdstr03a.store.core.windows.net.http > 10.0.0.5.49841: Flags [S.], seq 4006642089, ack 3817263869, win 8192, options [mss 1440,nop,wscale 8,sackOK,TS val 16441812 ecr 20885103], length 0
19:39:39.244468 IP 10.0.0.5.49844 > blob.by4prdstr03a.store.core.windows.net.http: Flags [S], seq 2866185680, win 29200, options [mss 1460,sackOK,TS val 20885214 ecr 0,nop,wscale 7], length 0
19:39:39.282427 IP blob.by4prdstr03a.store.core.windows.net.http > 10.0.0.5.49844: Flags [S.], seq 2981719721, ack 2866185681, win 8192, options [mss 1440,nop,wscale 8,sackOK,TS val 251497506 ecr 20885214], length 0
19:39:39.694987 IP 10.0.0.5.49846 > blob.by4prdstr03a.store.core.windows.net.http: Flags [S], seq 3767670712, win 29200, options [mss 1460,sackOK,TS val 20885327 ecr 0,nop,wscale 7], length 0
19:39:39.732916 IP blob.by4prdstr03a.store.core.windows.net.http > 10.0.0.5.49846: Flags [S.], seq 3203359824, ack 3767670713, win 8192, options [mss 1440,nop,wscale 8,sackOK,TS val 252129968 ecr 20885327], length 0
19:39:40.156825 IP 10.0.0.5.49847 > blob.by4prdstr03a.store.core.windows.net.http: Flags [S], seq 3579101855, win 29200, options [mss 1460,sackOK,TS val 20885442 ecr 0,nop,wscale 7], length 0
19:39:40.195583 IP blob.by4prdstr03a.store.core.windows.net.http > 10.0.0.5.49847: Flags [S.], seq 4080035833, ack 3579101856, win 8192, options [mss 1440,nop,wscale 8,sackOK,TS val 248501971 ecr 20885442], length 0
19:39:40.629351 IP 10.0.0.5.49848 > blob.by4prdstr03a.store.core.windows.net.http: Flags [S], seq 4141218741, win 29200, options [mss 1460,sackOK,TS val 20885560 ecr 0,nop,wscale 7], length 0
19:39:40.667349 IP blob.by4prdstr03a.store.core.windows.net.http > 10.0.0.5.49848: Flags [S.], seq 4243555986, ack 4141218742, win 8192, options [mss 1440,nop,wscale 8,sackOK,TS val 239278828 ecr 20885560], length 0
19:39:41.094803 IP 10.0.0.5.49849 > blob.by4prdstr03a.store.core.windows.net.http: Flags [S], seq 3248374978, win 29200, options [mss 1460,sackOK,TS val 20885676 ecr 0,nop,wscale 7], length 0
19:39:41.132761 IP blob.by4prdstr03a.store.core.windows.net.http > 10.0.0.5.49849: Flags [S.], seq 3221049508, ack 3248374979, win 8192, options [mss 1440,nop,wscale 8,sackOK,TS val 252944006 ecr 20885676], length 0
19:39:41.562114 IP 10.0.0.5.49851 > blob.by4prdstr03a.store.core.windows.net.http: Flags [S], seq 1294606288, win 29200, options [mss 1460,sackOK,TS val 20885793 ecr 0,nop,wscale 7], length 0
19:39:41.600053 IP blob.by4prdstr03a.store.core.windows.net.http > 10.0.0.5.49851: Flags [S.], seq 2966792076, ack 1294606289, win 8192, options [mss 1440,nop,wscale 8,sackOK,TS val 253672591 ecr 20885793], length 0
19:39:42.067320 IP 10.0.0.5.49852 > blob.by4prdstr03a.store.core.windows.net.http: Flags [S], seq 1115772455, win 29200, options [mss 1460,sackOK,TS val 20885920 ecr 0,nop,wscale 7], length 0
19:39:42.105264 IP blob.by4prdstr03a.store.core.windows.net.http > 10.0.0.5.49852: Flags [S.], seq 3815513120, ack 1115772456, win 8192, options [mss 1440,nop,wscale 8,sackOK,TS val 253671752 ecr 20885920], length 0
19:39:42.503180 IP 10.0.0.5.49853 > blob.by4prdstr03a.store.core.windows.net.http: Flags [S], seq 767194953, win 29200, options [mss 1460,sackOK,TS val 20886029 ecr 0,nop,wscale 7], length 0
19:39:42.541058 IP blob.by4prdstr03a.store.core.windows.net.http > 10.0.0.5.49853: Flags [S.], seq 1425207731, ack 767194954, win 8192, options [mss 1440,nop,wscale 8,sackOK,TS val 249354018 ecr 20886029], length 0
19:39:42.933938 IP 10.0.0.5.49854 > blob.by4prdstr03a.store.core.windows.net.http: Flags [S], seq 3582340320, win 29200, options [mss 1460,sackOK,TS val 20886136 ecr 0,nop,wscale 7], length 0
19:39:42.971811 IP blob.by4prdstr03a.store.core.windows.net.http > 10.0.0.5.49854: Flags [S.], seq 2175119805, ack 3582340321, win 8192, options [mss 1440,nop,wscale 8,sackOK,TS val 250806667 ecr 20886136], length 0
19:39:43.404763 IP 10.0.0.5.49855 > blob.by4prdstr03a.store.core.windows.net.http: Flags [S], seq 898161766, win 29200, options [mss 1460,sackOK,TS val 20886254 ecr 0,nop,wscale 7], length 0
19:39:43.442599 IP blob.by4prdstr03a.store.core.windows.net.http > 10.0.0.5.49855: Flags [S.], seq 3701454936, ack 898161767, win 8192, options [mss 1440,nop,wscale 8,sackOK,TS val 253687506 ecr 20886254], length 0
19:39:43.911979 IP 10.0.0.5.49856 > blob.by4prdstr03a.store.core.windows.net.http: Flags [S], seq 1499955502, win 29200, options [mss 1460,sackOK,TS val 20886381 ecr 0,nop,wscale 7], length 0
19:39:43.949794 IP blob.by4prdstr03a.store.core.windows.net.http > 10.0.0.5.49856: Flags [S.], seq 3350505712, ack 1499955503, win 8192, options [mss 1440,nop,wscale 8,sackOK,TS val 15177750 ecr 20886381], length 0
19:39:44.345042 IP 10.0.0.5.49857 > blob.by4prdstr03a.store.core.windows.net.http: Flags [S], seq 1112222148, win 29200, options [mss 1460,sackOK,TS val 20886489 ecr 0,nop,wscale 7], length 0
19:39:44.382991 IP blob.by4prdstr03a.store.core.windows.net.http > 10.0.0.5.49857: Flags [S.], seq 1720259443, ack 1112222149, win 8192, options [mss 1440,nop,wscale 8,sackOK,TS val 252956906 ecr 20886489], length 0
19:39:44.829384 IP 10.0.0.5.49858 > blob.by4prdstr03a.store.core.windows.net.http: Flags [S], seq 1551639384, win 29200, options [mss 1460,sackOK,TS val 20886610 ecr 0,nop,wscale 7], length 0
19:39:44.867528 IP blob.by4prdstr03a.store.core.windows.net.http > 10.0.0.5.49858: Flags [S.], seq 727859732, ack 1551639385, win 8192, options [mss 1440,nop,wscale 8,sackOK,TS val 255247494 ecr 20886610], length 0
19:39:45.308393 IP 10.0.0.5.49859 > blob.by4prdstr03a.store.core.windows.net.http: Flags [S], seq 1986122894, win 29200, options [mss 1460,sackOK,TS val 20886730 ecr 0,nop,wscale 7], length 0
19:39:45.346458 IP blob.by4prdstr03a.store.core.windows.net.http > 10.0.0.5.49859: Flags [S.], seq 1989019926, ack 1986122895, win 8192, options [mss 1440,nop,wscale 8,sackOK,TS val 250804251 ecr 20886730], length 0
19:39:45.795784 IP 10.0.0.5.49860 > blob.by4prdstr03a.store.core.windows.net.http: Flags [S], seq 2169300065, win 29200, options [mss 1460,sackOK,TS val 20886852 ecr 0,nop,wscale 7], length 0
19:39:45.833725 IP blob.by4prdstr03a.store.core.windows.net.http > 10.0.0.5.49860: Flags [S.], seq 2367039939, ack 2169300066, win 8192, options [mss 1440,nop,wscale 8,sackOK,TS val 252962100 ecr 20886852], length 0
